Artist Name,Song Name,Sum Lyrics
Coldplay,Only Superstition,The cardboard head I see Has found its way to me It's old and it's old and it's old Making me cry I sleep but I will not move I'm too scared to leave my room But I won't be defeated Oh no  What if cards don't go my way? And it's sure to spoil my day But in voices loud and clear you say to me It's only superstition It's only your imagination It's only all of the things that you fear and the things from which you can't escape.  Keep clean for the thousandth time Stand still and wait in line Some numbers are better than others Oh no  What if cards don't go my way? And it's sure to spoil my day But in voices loud and clear you say to me It's only superstition It's only your imagination It's only all of the things that you fear and the things which you cannot explain.  And it's making me cry love And it's making me cry And I'm slipping away love And I'm slipping away  It's only superstition only your imagination It's only superstition only superstition
Coldplay,Magic,Call it magic Call it true Call it magic When I'm with you And I just got broken Broken into two Still I call it magic When I'm next to you  And I don't and I don't and I don't and I don't No I don't It's true I don't no I don't no I don't no I don't want anybody else but you I don't no I don't no I don't no I don't No I don't It's true I don't no I don't no I don't no I don't want anybody else but you  Ooooh ooh ooh  Call it magic Cut me into two And with all your magic I disappear from view And I can't get over Can't get over you Still I call it magic You're such a precious jewel  And I don't and I don't and I don't and I don't No I don't It's true I don't no I don't no I don't no I don't want anybody else but you I don't no I don't no I don't no I don't No I don't It's true I don't no I don't no I don't no I don't want anybody else but you  Wanna fall I fall so far I wanna fall I fall so hard And I call it magic And I call it true I call it magic  Ooooh ooh ooh Ooooh ooh ooh Ooooh ooh ooh Ooooh ooh ooh  And if you were to ask me After all that we've been through Still believe in magic? Oh yes I do Oh yes I do Yes I do Oh yes I do Of course I do
Coldplay,Violet Hill,It was a long and dark December From the rooftops I remember There was snow white snow  Clearly I remember From the windows they were watching While we froze down below  When the future's architectured By a carnival of idiots on show You'd better lie low  If you love me won't you let me know?  Was a long and dark December When the banks became cathedrals And a fox became God  Priests clutched onto Bibles Hollowed out to fit their rifles And a cross was held aloft  Bury me in armour When I'm dead and hit the ground My nerves are poles that unfroze  And if you love me won't you let me know?  I don't want to be a soldier Who the captain of some sinking ship Would stow far below  So if you love me why d'you let me go?  I took my love down to Violet Hill There we sat in snow All that time she was silent still  Said if you love me won't you let me know? If you love me won't you let me know?
Coldplay,Now My Feet Won't Touch The Ground,Let me go boys let me go Push my boat from the highest cliff To the sea below Rocks are waiting boys If rocks await Swoop down from the sky and catch me like a bird of prey  Now my feet won't touch the ground Now my head won't stop You wait a lifetime to be found Now my feet won't touch the ground  Singing now my feet won't touch the ground Now my head won't stop You wait a lifetime to be found Now my feet won't touch the ground Now my feet won't touch the ground
Coldplay,Speed Of Sound,How long before I get in Before it starts before I begin? How long before you decide But before I know what it feels like?  Where to? Where do I go? If you never try then you'll never know How long do I have to climb Up on the side of this mountain of mine?  Look up I look up at night Planets are moving at the speed of light Climb up up in the trees Every chance that you get is a chance you seize  How long am I gonna stand With my head stuck under the sand? I'll start before I can stop But before I see things the right way up  All that noise and all that sound All those places I got found And birds go flying at the speed of sound To show you how it all began Birds came flying from the underground If you could see it then you'd understand  Ideas that you'll never find All the inventors could never design The buildings that you put up Japan and China all lit up  The sign that I couldn't read Or a light that I couldn't see Some things you have to believe But others are puzzles puzzling me  All that noise and all that sound All those places I got found And birds go flying at the speed of sound To show you how it all began  Birds came flying from the underground If you could see it then you'd understand Ah when you see it then you'll understand  All those signs— I knew what they meant Some things you can invent Some get made and some get sent Ooh  And birds go flying at the speed of sound To show you how it all began Birds came flying from the underground If you could see it then you'd understand Ah when you see it then you'll understand
Coldplay,What If?,What if there was no light? Nothing wrong nothing right? What if there was no time? And no reason or rhyme? What if you should decide That you don't want me there by your side? That you don't want me there in your life?  What if I got it wrong? And no poem or song Could put right what I got wrong Or make you feel I belong? What if you should decide That you don't want me there by your side? That you don't want me there in your life?  Ooh that's right Let's take a breath jump over the side Ooh that's right How can you know it if you don't even try? Ooh that's right  Every step that you take Could be your biggest mistake It could bend or it could break But that's the risk that you take What if you should decide That you don't want me there in your life? That you don't want me there by your side?  Ooh that's right Let's take a breath jump over the side Ooh that's right How can you know it when you don't even try? Ooh that's right  Oh ooh that's right Let's take a breath jump over the side Ooh that's right You know that darkness always turns into light Ooh that's right
Coldplay,Swallowed In The Sea,You cut me down a tree And brought it back to me And that's what made me see Where I was going wrong You put me on a shelf And kept me for yourself I can only blame myself You can only blame me  And I could write a song A hundred miles long Well that's where I belong And you belong with me  And I could write it down Or spread it all around Get lost and then get found Or swallowed in the sea  You put me on a line And hung me out to dry And darling that's when I Decided to go see  You cut me down to size And opened up my eyes Made me realize What I could not see  And I could write a book The one they'll say that shook The world and then it took It took it back from me  And I could write it down Or spread it all around Get lost and then get found And you'll come back to me Not swallowed in the sea  (Ooh ah) (Ooh ah-ah-ah)  And I could write a song A hundred miles long Well that's where I belong And you belong with me  The streets you're walking on A thousand houses long Well that's where I belong And you belong with me  Oh what good is it to live With nothing left to give Forget but not forgive Not loving all you see  All the streets you're walking on A thousand houses long Well that's where I belong And you belong with me Not swallowed in the sea  You belong with me Not swallowed in the sea Yeah you belong with me Not swallowed in the sea
Coldplay,In My Place,In my place in my place Were lines that I couldn't change I was lost oh yeah  And I was lost I was lost Crossed lines I shouldn't have crossed I was lost oh yeah  Yeah how long must you wait for it? Yeah how long must you pay for it? Yeah how long must you wait for it? For it  I was scared I was scared Tired and under-prepared But I wait for it  And if you go if you go And leave me down here on my own Then I'll wait for you yeah  Yeah how long must you wait for it? Yeah how long must you pay for it? Yeah how long must you wait for it? For it  Sing it please please please Come back and sing to me To me me  Come on and sing it out now now Come on and sing it out To me me Come back and sing  In my place in my place Were lines that I couldn't change I was lost oh yeah Oh yeah
Coldplay,Death And All His Friends,All winter we got carried Away over on the roof tops. Let's get married All summer we just hurried So come over just be patient and don't worry So come over just be patient and don't worry  So come over just be patient and don't worry  And don't worry  No I don't want a battle from beginning to end I don't want a cycle of recycled revenge I don't want to follow death and all of his friends  No I don't want a battle from beginning to end I don't want a cycle of recycled revenge I don't want to follow death and all of his friends  And in the end we lie awake And we dream of making our escape  And in the end we lie awake And we dream of making our escape
Coldplay,Princess Of China,[Rihanna:] Oh oh-oh-oh oh-oh-oh oh-oh-oh  [Chris Martin:] Once upon a time somebody ran Somebody ran away saying fast as I can I've got to go I've got to go Once upon a time we fell apart You're holding in your hands the two halves of my heart Oh-oh oh-oh-oh  [Rihanna:] Oh oh-oh-oh oh-oh-oh oh-oh-oh  [Rihanna (Chris Martin):] Once upon a time we burned bright Now all we ever seem to do is fight On and on (And on and on and on) (Once upon a time on the same side) (Once upon a time on the same side) (In the same game) And why'd you have to go? Have to go and throw water on my flame  [Rihanna:] I could've been a princess you'd be a king Could've had a castle and worn a ring But no you let me go I could've been a princess you'd be a king Could've had a castle and worn a ring But no you let me go  [Chris Martin & Rihanna:] You stole my star La la la la la la la la La la la la la la la la La la la la You stole my star La la la la la la la la  [Rihanna:] Oh oh-oh-oh oh-oh-oh oh-oh-oh Oh oh-oh-oh oh-oh-oh oh-oh-oh  [Chris Martin & Rihanna:] 'Cause you really hurt me No you really hurt me 'Cause you really hurt me No you really hurt me 'Cause you really hurt me Oh you really hurt me oh 'Cause you really hurt me Oh you really hurt me
Coldplay,Don't Let It Break Your Heart,And if I lost the map If I lost it all Or fell into the trap Then she'd call  When you're tired of racing and you Found you never left the start Come on baby don't let it break your heart  Though heavily we bled Still on we crawl Trying to catch a cannonball And a slow burning tide Through my veins is flowing From my shipwreck I heard her call And she sang  When you're tired of aiming your arrows Still you never hit the mark oh-oh And even in your rains and shadows Still we're never gonna part oh-oh Come on baby don't let it break your heart  Oh oh-oh oh-oh oh Don't let it break your heart Oh oh-oh oh-oh oh Don't let it break your heart  Don't let it break your heart
Coldplay,Trouble,Oh no I see A spider web is tangled up with me And I lost my head And thought of all the stupid things I'd said  Oh no what's this A spider web and I'm caught in the middle So I turn to run And thought of all the stupid things I'd done  And I I never meant to cause you trouble And I I never meant to do you wrong And I well if I ever caused you trouble And oh no I never meant to do you harm  Oh no I see A spider web and it's me in the middle So I twist and turn But here am I in my little bubble  Singing that I I never meant to cause you trouble And I I never meant to do you wrong And I well if I ever caused you trouble And oh no I never meant to do you harm  They spun a web for me They spun a web for me They spun a web for me
Coldplay,High Speed,Can anybody fly this thing? Before my head explodes Or my head starts to ring  We've been living life inside a bubble We've been living life inside a bubble  Confidence in you Is confidence in me Is confidence in high speed  Can anybody stop this thing? Before my head explodes Or my head starts to ring  We've been living life inside a bubble We've been living life inside a bubble  Confidence in you Is confidence in me Is confidence in high speed  High speed High speed  High speed you on High speed you on High speed you on High speed
Coldplay,Life In Technicolor II,There's a wild wind blowing Down the corner of my street Every night there the headlights are glowing There's a cold war coming On the radio I heard Baby it's a violent world  Oh oh love don't let me go Won't you take me where the street lights glow? I could hear it coming I could hear the sirens sound Now my feet won't touch the ground  Time came a-creeping Oh and time's a loaded gun Every road is a ray of light It goes on Time only can lead you on  Still it's such a beautiful night  Oh oh love don't let me go Won't you take me where the street lights glow? I could hear it coming Like a serenade of sound Now my feet won't touch the ground  Gravity release me And don't ever hold me down Now my feet won't touch the ground
Coldplay,Amsterdam,Come on oh my star is fading And I swerve out of control If I if I'd only waited I'd not be stuck here in this hole  Come here oh my star is fading And I swerve out of control And I swear I waited and waited I've got to get out of this hole  But time is on your side It's on your side now Not pushing you down and all around It's no cause for concern  Come on oh my star is fading And I see no chance of release And I know I'm dead on the surface But I am screaming underneath  And time is on your side It's on your side now Not pushing you down and all around Oh it's no cause for concern  Stuck on the end of this ball and chain And I'm on my way back down again Stood on a bridge tied to a noose Sick to the stomach You can say what you mean But it won't change a thing I'm sick of the secrets  Stood on the edge Tied to a noose And you came along And you cut me loose  You came along And you cut me loose You came along And you cut me loose
Coldplay,Another's Arms,Late night watching TV Used to be you here beside me Used to be your arms around me Your body on my body  When the world means nothing to me Another's arms Another's arms When the pain just rips right through me Another's arms Another's arms  Late night watching TV Used to be you here beside me Is there someone there to reach me? Or someone there to find me?  When the pain just rips right through me Another's arms Another's arms And that's just torture to me Another's arms Another's arms  Pull yourself into me Another's arms Another's arms When the world means nothing to me Another's arms Another's arms  Got to pull you close into me Another's arms Another's arms Pull yourself right through me Another's arms Another's arms  Late night watching TV Wish that you were here beside me Wish that your arms were around me Your body on my body
Coldplay,Everglow,Oh they say people come Say people go This particular diamond was extra special And though you might be gone And the world may not know Still I see you celestial  Like a lion you ran A goddess you rolled Like an eagle you circled In perfect purple So how come things move on How come cars don't slow When it feels like the end of my world? When I should but I can't let you go?  But when I'm cold cold When I'm cold cold There's a light that you give me When I'm in shadow There's a feeling you give me an everglow  Like brothers in blood Sisters who ride And we swore on that night We'd be friends 'til we die But the changing of winds And the way waters flow Life as short as the falling of snow And now I'm gonna miss you I know  But when I'm cold cold In water rolled salt And I know that you're with me And the way you will show And you're with me wherever I go 'Cause you give me this feeling this everglow  What I wouldn't give for just a moment to hold Yeah I live for this feeling this everglow  So if you love someone you should let them know Oh the light that you left me will everglow
Lana Del Rey,Don't Let Me Be Misunderstood,Baby you understand me now? If sometimes you see that I'm mad Don't you know no one alive can always be an angel? When everything goes wrong you see some bad  But I'm just a soul whose intentions are good Oh Lord please don't let me be misunderstood  You know sometimes baby I'm so carefree With a joy that's hard to hide And then sometimes again it seems that all I have is worry And then you're bound to see my other side  But I'm just a soul whose intentions are good Oh Lord please don't let me be misunderstood  If I seem edgy I want you to know I never meant to take it out on all you Life has its problems And I get more than my share But that's one thing I never mean to do  'Cause I love you Oh baby I'm just human Don't you know I have faults like anyone? Sometimes I find myself alone regretting Some little foolish thing Some simple thing that I've done  'Cause I'm just a soul whose intentions are good Oh Lord please don't let me be misunderstood I try so hard don't let me be misunderstood I try so hard don't let me be misunderstood
Lana Del Rey,Dark Paradise,All my friends tell me I should move on I'm lying in the ocean singing your song. Loving you forever can't be wrong Even though you're not here won't move on. Every time I close my eyes It's like a dark paradise No one compares to you I'm scared that you Won't be waiting on the other side.
Lana Del Rey,Honeymoon,We both know that it's not fashionable to love me But you don't go 'cause truly there's nobody for you but me We could cruise to the blues Wilshire Boulevard if we choose Or whatever you wanna do We make the rules  Our honeymoon Our honeymoon Our honeymoon  Say you want me too Say you want me too Dark blue Dark blue  We both know the history of violence that surrounds you But I'm not scared there's nothing to lose now that I've found you And we could cruise to the news Pico Boulevard in your used Little bullet car if we choose  Mr. Born-To-Lose  Our honeymoon Our honeymoon Our honeymoon  Say you want me too Say you want me too Dark blue Dark blue  There are violets in your eyes There are guns that blaze around you There are roses in between my thighs and fire that surrounds you It's no wonder every man in town had neither fought nor found you  Everything you do is elusive too even your honey dew  Our honeymoon Our honeymoon Our honeymoon  Dreaming away your life Dreaming away your life Dreaming away your life  Dreaming away your life Dreaming away your life Dreaming away your life
Lana Del Rey,24,There's only 24 hours in a day And half as many ways for you to lie to me my little love There's only 24 hours in a day And half of those you lay awake With thoughts of murder and carnage  If you lie down with dogs then you'll get fleas Be careful of the company you keep  There's only 24 hours And that's not enough To lie like you lie Or love like you love  There's only 24 hours in a day And half of those you lay Between the sheets with me my lying love There's only 24 hours so you'd say For most of them you pay For all the things they paid you for my love  If you lie down with dogs then you'll get fleas Be careful of the ones you choose to leave  There's only 24 hours And that's not enough To lie like you lie Or love like you love  Give me your heat Give me your diamonds You hit that street And my crooked words You count to three While they're all dying You're hard to reach You're cold to touch
Lana Del Rey,Summertime Sadness,Kiss me hard before you go Summertime sadness I just wanted you to know That baby you're the best  I got my red dress on tonight Dancing in the dark in the pale moonlight Done my hair up real big beauty queen style High heels off I'm feeling alive  Oh my God I feel it in the air Telephone wires above are sizzling like a snare Honey I'm on fire I feel it everywhere Nothing scares me anymore  (1 2 3 4)  Kiss me hard before you go Summertime sadness I just wanted you to know That baby you're the best  I got that summertime summertime sadness S-s-summertime summertime sadness Got that summertime summertime sadness Oh oh oh oh oh  I'm feeling electric tonight Cruising down the coast going 'bout 99 Got my bad baby by my heavenly side I know if I go I'll die happy tonight  Oh my God I feel it in the air Telephone wires above are sizzling like a snare Honey I'm on fire I feel it everywhere Nothing scares me anymore  (1 2 3 4)  Kiss me hard before you go Summertime sadness I just wanted you to know That baby you're the best  I got that summertime summertime sadness S-s-summertime summertime sadness Got that summertime summertime sadness Oh oh oh oh oh  Think I'll miss you forever Like the stars miss the sun in the morning sky Later's better than never Even if you're gone I'm gonna drive (drive drive)  I got that summertime summertime sadness S-s-summertime summertime sadness Got that summertime summertime sadness Oh oh oh oh oh  Kiss me hard before you go Summertime sadness I just wanted you to know That baby you're the best  I got that summertime summertime sadness S-s-summertime summertime sadness Got that summertime summertime sadness Oh oh oh oh oh
Lana Del Rey,Carmen,Darling darling Doesn't have a problem Lying to herself 'Cause her liquor's top shelf It's alarming honestly How charming she can be Fooling everyone Telling 'em she's having fun  She says You don't want to be like me Don't wanna see all the things I've seen I'm dying I'm dying She says You don't want to get this way Famous and dumb at an early age Lying I'm lying  The boys the girls They all like Carmen She gives them butterflies bats her cartoon eyes She laughs like God Her mind's like a diamond Audiotune lies She's still shining Like lightning whoa whoa White lightning  Carmen Carmen Staying up 'til morning Only seventeen but she walks the streets so mean It's alarming truly How disarming you can be Eating soft ice cream Coney Island queen  She says You don't want to be like me Looking for fun getting high for free I'm dying I'm dying She says You don't want to get this way Street walk at night and a star by day It's tiring tiring  The boys the girls They all like Carmen She gives them butterflies Bats her cartoon eyes She laughs like God Her mind's like a diamond Audiotune lies She's still shining Like lightning whoa whoa White lightning  Baby's all dressed up with nowhere to go That's the little story of the girl you know Relying on the kindness of strangers Tying cherry knots Smiling doing party favors Put your red dress on put your lipstick on Sing your song song now the camera's on And you're alive again  Mon amour je sais que tu m'aimes aussi Tu as besoin de moi tu as besoin de moi dans ta vie Tu ne peux vivre sans moi Et je mourrais sans toi Je tuerais pour toi  The boys the girls They all like Carmen She gives them butterflies Bats her cartoon eyes She laughs like God Her mind's like a diamond Audiotune lies She's still shining Like lightning whoa whoa White lightning Like lightning whoa whoa White lightning  Darling darling Doesn't have a problem Lying to herself 'Cause her liquor's top shelf
Maroon 5,Tangled,Mm  I'm full of regret For all things that I have done and said And I don't know If it'll ever be okay to show My face around here (Face around here) Sometimes I wonder if I disappear  Would you ever turn your head and look? See if I'm gone 'Cause I fear  There is nothing left to say to you That you wanna hear that you wanna know I think I should go The things I've done are way too shameful oh  You're just innocent A helpless victim of a spider's web And I'm an insect Goin' after anything that I can get  So you better turn your head and run And don't look back 'Cause I fear  There is nothing left to say to you That you wanna hear that you wanna know I think I should go The things I've done are way too shameful oh (Shameful shameful) And I've done you so wrong Treated you bad strung you along oh shame on myself I don't know how I got so tangled up  Oh oh oh yeah Yeah yeah yeah-yeah yeah  You better turn your head and run See if I'm gone 'Cause I fear  There is nothing left to say to you That you wanna hear that you wanna know I think I should go The things I've done are way too shameful oh (Shameful shameful) And I've done you so wrong Treated you bad strung you along oh shame on myself I don't know how I got so tangled up Yeah tangled (And I've done you so wrong) (Treated you bad strung you along oh shame on myself) (I don't know how I got so tangled up)
