Artist Name,Song Name,Sum Lyrics
Maroon 5,Never Gonna Leave This Bed,You push me I don't have the strength to Resist or control you To take me down take me down  You hurt me But do I deserve this? You make me so nervous Calm me down calm me down  Wake you up In the middle of the night to say I will never walk away again I'm never gonna leave this bed oh  So come here And never leave this place Perfection of your face Slows me down slows me down  So fall down I need you to trust me Go easy don't rush me Help me out why don't you help me out?  Wake you up In the middle of the night to say I will never walk away again I'm never gonna leave this bed oh  So you say Go. It isn't working. And I say No. It isn't perfect. So I stay instead I'm never gonna leave this bed  Take it take it all Take all that I have I'd give it all away just to get you back  And fake it fake it all Take what I can get  Knockin' so loud Can you hear me yet? Try to stay awake but you can't forget  Wake you up In the middle of the night to say I will never walk away again I'm never gonna leave this bed oh  So you say Go. It isn't working. And I say No. It isn't perfect. So I stay instead I'm never gonna leave this bed ooh  Take it take it all Take all that I have Take it take it all Take all that I have Take it take it all Take all that I have Take it take it all Take all that I have  Take it take it all Take all that I have Take it take it all Take all that I have Take it take it all Take all that I have
Maroon 5,Better That We Break,I never knew perfection 'til I heard you speak and now it kills me Just to hear you say the simple things  Now waking up is hard to do And sleeping's impossible too Everything's reminding me of you What can I do?  It's not right not OK Say the words that you say Maybe we're better off this way? I'm not fine I'm in pain It's harder everyday Maybe we're better off this way? It's better that we break  A fool to let you slip away I chase you just to hear you say You're scared and that you think that I'm insane  The city looks so nice from here Pity I can't see it clearly While you're standing there it disappears It disappears  It's not right not OK Say the words that you say Maybe we're better off this way? I'm not fine I'm in pain It's harder everyday Maybe we're better off this way? It's better that we break  Saw you sitting all alone You're fragile and you're cold But that's all right Life these days is getting rough They've knocked you down and beat you up But it's just a roller-coaster anyway yeah  It's not right not OK Say the words that you say Maybe we're better off this way? I'm not fine I'm in pain It's harder everyday Maybe we're better off this way?  I'm not fine not OK Say the words that you say Maybe we're better off this way? I'm not fine I'm in pain It's harder everyday Maybe we're better off this way? It's better that we break baby
Maroon 5,Through With You,Can you see me floating above your head As you lay in bed thinking about everything That you did not do? 'Cause saying I love you Has nothing to do with meaning it Oh oh oh And I don't trust you 'cause every time you're here Your intentions are unclear I spend every hour waiting For a phone call that I know will never come I used to think you were the one now I'm sick of thinking anything at all  You ain't ever coming back to me And that's not how things were supposed to be You take my hand just to give it back No other lover has ever done that  Do you remember the way we used to melt? Do you remember how it felt when I touched you? Oh 'cause I remember very well  And how long has it been since someone you let in Has given what I gave to you? And at night when you sleep do you dream I would be there Just for a minute or two do you?  You ain't ever coming back to me That's not how things were supposed to be You take my hand just to give it back No other lover has ever done that Heartache heartache I just have so much A simple love with a complex touch And there is nothing you can say or do I called to let you know I'm through with you oh  You ain't ever coming back to me And that's not how things were supposed to be You take my hand just to give it back No other lover has ever done that Heartache heartache I just have so much A simple love with a complex touch And there is nothing you can say or do I called to let you know I'm through I called to let you know I'm through I called to let you know I'm through with you  I ain't ever coming back to you
Maroon 5,Kiwi,You're such a flirt I know you hurt And so do I I empathize I see you out you never cared A conversation that we never shared  But it's so strange it's something new Amazing feelings that I have for you I close my eyes when I'm alone Wonder what it'd be like to make you moan  I wanna give you something better Than anything you've ever had A stronger and a faster lover The world it disappears so fast  Sweet kiwi Your juices dripping down my chin So please let me Don't stop it before it begins  So give it up and don't pretend And spread your arms and legs across the bed And when you shake you won't regret The things I whisper in your ear (What?) I said  I wanna give you something better (You wanna give me something better.) Than anything you've ever had (Than anything I've ever had.) A stronger and a faster lover (A stronger and a faster lover) The world it disappears so fast (It disappears so fast).  Sweet kiwi Your juices dripping down my chin So please let me Don't stop it before it begins  I can't wait to take you home Fingers through your hair Kisses on your back Scratch me with your nails  Save me from myself Show me how to care Get everything out Dripping everywhere  Lipstick smeared all over your face How much longer must we wait? Don't think that I can wait  Sweet kiwi Your juices dripping down my chin So please let me Don't stop it before it begins hey yeah  Sweet kiwi (Wanna give you something better than this.) Your juices dripping down my chin hey yeah So please let me (Wanna give you something better than this.) Don't stop it before it begins  Don't stop it before it begins Don't stop it before it begins Don't stop it before it begins Don't stop it before it begins
Maroon 5,Get Back In My Life,You are relentless I am defenseless Why did you knock me down tonight? You beat me senseless I just don't get this How many times do I have to try?  Your whisper so clear The world disappears As I fall into the darkness It's impossible to express How good it feels I'm wrapped up I'm sealed So tired I'll never be free All night don't fight the feeling  Get back in my life Come knock on my door What I'm looking for I think you should know You started a fire Burned me to the floor Please don't resist anymore I'll never leave you alone Oh yeah yeah  You reprimanded You're so demanding But I've got time I don't mind at all (Oh) You're picture perfect Completely worth it You've got my back against the wall (Yeah yeah)  Your whisper so clear The world disappears As I fall into the darkness It's impossible to express How good it feels I'm wrapped up I'm sealed So tired I'll never be free All night don't fight the feeling  Get back in my life Come knock on my door What I'm looking for I think you should know You started a fire Burned me to the floor Please don't resist anymore I'll never leave you alone  And can you hear me calling? I'm screaming scratching crawling You ignore me 'cause I'm always Coming back to you coming back to you And you know how much I miss it And you know I can't resist it See your lips and just come running Right on back to you right on back to you  Get back in my life Come knock on my door What I'm looking for I think you should know You started a fire Burned me to the floor I can't do this anymore I'll never leave you alone  (Get back in my life) Get back in my life (Ooh) (What I'm looking for) Come on now (I think you should know) Yeah yeah yeah Come knock on my door (Oh) What I'm looking for I'll never leave you alone Get back in my life (Oh) Come scream and scratch on my door What I'm looking for I can't do this anymore Get back in my life (Yeah yeah yeah) Come scream and scratch on my door What I'm looking for Get back in my life (Get back in my life) What I'm looking for
Maroon 5,How,Oh  I have been searching for your touch Unlike any touch I've ever known And I never thought about you much 'Til I'm broken down and all alone oh  Though I don't understand the meaning of love I do not mind if I die trying oh Took it for granted when you lifted me up  I'm asking for your help I am going through hell Afraid nothing can save me but the sound of your voice You cut out all the noise And now that I can see mistakes so clearly now I'd kill if I could take you back  But how? But how?  I can feel it in my guts What's going on with him now? And don't patronise me with lies I'm a man be a woman now oh  I have been bound by the shackles of love And I don't mind if I die tied up oh Took it for granted when you lifted me up  I'm asking for your help I am going through hell Afraid nothing can save me but the sound of your voice You cut out all the noise And now that I can see mistakes so clearly now I'd kill if I could take you back  But how? But how? But how? But how?  Oh yeah Why must we be so ugly? And please do not think ill of me Why does the one you love Become the one who makes you want to cry Why? Why? Why?  (And how? How?)  But I don't understand the meaning of love I do not mind if I die trying I do not mind if I die trying I do not mind if I die trying
Michael Jackson,All The Things You Are,You are the promised kiss of springtime That makes the lonely winter seem long You are the breathless hush of evening That trembles on the brink of a lovely song You are the angel glow that lights a star The dearest things I know are what you are Someday my happy arms will hold you And someday I'll know that moment divine When all the things you are are mine  You are the angel glow that lights a star The dearest things I know are what you are Some some some some day  My happy arms will hold you And someday I'll know that moment divine When all the things you are are mine Yeah yeah all the things you are are mine All the things you are got to be mine Someday you are are mine All the things you are got to be mine All the things you are got to be mine
Michael Jackson,Get On The Floor,I love the way you shake your thing Especially (Especially)  There's a chance for dancin' All night long And it will be soothin' With a song I sure would like just to groove with you So get on the floor haha hooah! And dance with me
Michael Jackson,Dangerous,I never knew but I was walkin' the line (Hee!) Come go with me I said I have no time She came at me in sections with the eyes of desire I fell trapped into her web of sin My baby left me here tonight
Michael Jackson,Ghosts,There's a ghost down in the hall There's a ghoul upon the bed There's something in the walls There's blood up on the stairs And it's floating through the room And there's nothing I can see I know This place is doomed Because now it's haunting me  I don't understand it!
Michael Jackson,Scared Of The Moon,Alone she lays waiting Surrounded by gloom Invaded by shadows Painting the room The light from the window Cuts through the air And pins the child lying there Scared of the moon  She pulls up the covers And shivers in fright She hides from the color That rides on the night The light through the window That lights up the sky And causes her mournful cry Scared of the moon  There's nothing wrong Don't be bothered they said It's just childish fantasies turning your head No need to worry It's really too soon But there she lies shivering Scared of the moon  Scared of the moon Scared of the moon Scared of the moon Scared of the moon  The years go by swiftly And soon childhood ends But life is still fearful When evening descends The fear of a child Still intrudes the night Returning on beams of light Scared of the moon  The feeling of terror She felt as a youth Has turned from a fantasy Into the truth The moon is the enemy Twisting her soul And taking its fearful toll Scared of the moon  But now there are others who sit in a room And wait for the sunlight to brighten their gloom Together they gather Their lunacy shade But knowing just why they're scared Scared of the moon  Scared of the moon Scared of the moon Scared of the moon Scared of the moon
Michael Jackson,Black Or White,Michael Jackson: I'm not going to spend my life being a color I am tired of this devil It's black it's white hoo! (Shamone dah) I ain't scared of your brother You've got things to do tomorrow
Michael Jackson,We Are Here To Change The World,We're on a mission in the everlastin' light that shines A revelation of the truth in chapters of our minds  (So long bad times) We're gonna shake it up and break it up We're sharin' a light brighter than the sun (Hello good times) We're here to simulate eliminate And congregate illuminate  (We are here to change the world) Hee! Gonna change the world hee! (We are here to change the world) Gonna change the world ooh!  So do surrender 'cause the power is deep inside my soul Ah sing it  (We are here to change the world) Hee! Gonna change the world baby (We are here to change the world) Hee! Gonna change the world ooh!  Ooh! (We are here to change the world) We're gonna change the world girl (We are here to change the world) My brothers my brother baby We're gonna change the world (We are here to change the world) Hee! Deep down in my body Deep down in my soul baby (We are here to change the world) Hee! Gonna change the world Ooh!
Michael Jackson,Monster,[Michael Jackson:] Everywhere you seem to turn there's a monster Paparazzi got you scared like a monster monster monster  (Too bad) Oh oh Hollywood just look in the mirror And tell me you like what you see Monster he's like an animal (he's amonster) just like an animals (he'm an animal) And he's moving in the air. Everybody wanna be a video star  Why are they never satisfied with'n all you give?
Michael Jackson,Scream,Michael Jackson: With such confusion don't it make you wanna scream? (Make you wanna screaming) Your bash abusin' victimize within the scheme (You try to cope with every lie they scrutinize) {Somebody please have mercy} {'Cause I just can't take it]
Michael Jackson,She's Out Of My Life,She's out of my life She's out of my life And I don't know whether to laugh or cry I don't know whether to live or die And it cuts like a knife She's out of my life  It's out of my hands It's out of my hands To think for two years she was here And I took her for granted I was so cavalier Now the way that it stands She's out of my hands  So I've learned that love's not possession And I've learned that love won't wait Now I've learned that love needs expression But I've learned too late  And she's out of my life She's out of my life Damned indecision and cursed pride Kept my love for her locked deep inside And it cuts like a knife She's out of my life
Michael Jackson,Jam,[Michael Jackson:] Nation to nation all the world must come together Face the problems that we see then maybe somehow we can work it out I asked my neighbor for a favor she said later What has come of all the people have we lost love of what it's about? I have to find my peace 'cause no one seems to let me be False prophets cry of doom what are the possibilities? I told my brother there'll be problems times and tears for fears But we must live each day like it's the last.
Michael Jackson,You Are My Life,Once all alone I was lost in a world of strangers No one to trust On my own I was lonely  You suddenly appeared It was cloudy before but now it's all clear You took away the fear And you brought me back to the light. You're my daytime my nighttime my world You are my life  Now I wake up every day With this smile upon my face.
Michael Jackson,Johnny Raven,He's born to be wild  Free and untamed that's how I've grown (He's Johnny Raven) Settling down ain't my nature Roots I'll never own (He's Johnny Raven) Oh your smile But tell me ain't your child How can you cage a bird Born to be wild (Born to be wild)  I'm Johnny Raven (He's Johnny Raven) By and by (By and By) Oh I'm gonna leave your nest girl Another nest to try Ooh Johnny Raven (Oh Johnny Raven) Girl you know I shouldn't have loved you Yeah but I gotta leave you When my restless heart says fly  Look at you little girl You feel love so deep yeah yeah (He's Johnny Raven) If I could change in a second I'd change for you like that Stay right here for keeps (He's Johnny Raven) But I'm hungry for new thrills Stray I will Seems I gotta need one girl Never can feel  Yeah I'm Johnny Raven (He's Johnny Raven) By and by Oh I'm gonna leave your nest girl Another nest to try Ooh Johnny Raven (Oh Johnny Raven) Girl you know I shouldn't have loved you Yeah but I gotta leave you When my restless heart says goodbye  Everybody knows my name I'm Johnny Raven yeah yeah (He's Johnny Raven) Yeah yeah by and by (He's Johnny Raven) Ooh I'm gonna fly and when you cry (Johnny Johnny Johnny) Part of me is gonna die (He's Johnny Raven) (Ooh ooh ooh ooh)  Ooh I'm Johnny Raven yeah yeah (Johnny Johnny Johnny) Yeah yeah by and by (He's Johnny Raven) (Ooh ooh ooh ooh) Ooh I'm gonna fly and when you cry yeah (Johnny Johnny Johnny) Part of me is gonna die (He's Johnny Raven) (Ooh ooh ooh ooh)  (Johnny Johnny Johnny) (He's Johnny Raven) (Ooh ooh ooh ooh) (Johnny Johnny Johnny) (He's Johnny Raven) (Ooh ooh ooh ooh)  (Johnny Johnny Johnny) (He's Johnny Raven) (Ooh ooh ooh ooh) (Johnny Johnny Johnny)
Michael Jackson,Dirty Diana,Oh no oh no no  You'll never make me stay So take your weight off of me I know your every move So won't you just let me be?  I've been here times before But I was too blind to see That you seduce every man This time you won't seduce me. She's saying That's OK Hey baby do what you please I have the stuff that you want I am the thing that you need.
Michael Jackson,Threatened,Michael Jackson: You're fearing me 'cause you know I'm a beast Watching you when you sleep when you're in bed I'm underneath. While you sleep while you creep you should be threatened Every time your lady speaks she speaks to me threatened Half of me you'll never be so you should feel threatened by me.
Michael Jackson,To Make My Father Proud,To make my father proud To make my mother smile I need not conquer worlds or fame Nor set the pace for style If I can follow through On what they gave me as my tools I'll find a way to sail my course Avoiding ships of fools  If I don't come up number one I'll stand not well apart As one for numbered numbers When knowing in my heart I've done all to be done To always do my best By listening to me myself So he can do the rest  War without compromise Shall follow the feel of constant care  In my eleventh hour I'll be a man aware To face whatever falls my way Prepared and unashamed To just be called a part of God For which I have been named A man and woman's youngest son While growing still a child And that will make my father proud And make my mother smile
Michael Jackson,Human Nature,Why?  Looking out across the nighttime The city winks a sleepless eye Hear her voice shake my window Sweet seducing sighs Get me out into the nighttime Four walls won't hold me tonight If this town is just an apple Then let me take a bite.
Michael Jackson,Whatever Happens,[Michael Jackson:] He gives another smile tries to understand her side To show that he cares She can't stay in the room She's consumed with everything that's been goin' on She says  Whatever happens don't let go of my hand  Everything will be alright he assures her But she doesn't hear a word that he says Preoccupied she's afraid Afraid that what they're doing is not right He doesn't know what to say so he prays Whatever whatever whatever  Whatever happens don't let go of my hand Whatever happens don't let go of my hand Whatever happens don't you let go of my hand  Don't let go of my hand Don't let go of my hand  He's working day and night thinks he'll make her happy Forgetting all the dreams that he had He doesn't realize it's not the end of the world It doesn't have to be that bad She tries to explain It's you that makes me happy Whatever whatever whatever  Whatever happens don't let go of my hand See whatever happens don't let go of my hand Whatever happens don't let go of my hand See whatever happens don't you go of my hand See whatever happens don't you let go of my hand  See don't you do it baby I said yeah Don't you let go baby See you Don't you do it  Whatever happens don't let go of my hand Whatever happens don't you let go of my hand Whatever happens don't you let go of my hand  Don't you let go baby Don't you don't you let go I said yeah Can I get how it feels baby Don't you let go baby Yeah Oh Whatever happens just don't let go of my hand  [Carlos Santana:] Thank you man! [Michael Jackson:] Thank you Carlos!
Michael Jackson,Why You Wanna Trip On Me,They say I'm different They don't understand But there's a bigger problem That's much more in demand You've got world hunger Not enough to eat So there's really no time To be trippin' on me You've got school teachers Who don't wanna teach You've got grown people Who can't write or read You got strange diseases Ah but there's no cure You got many doctors That aren't so sure So tell me  (Why why) Why you wanna trip on me? (Why why why why) Why you wanna trip on me? (Why) Stop trippin'  We have got more problems Than we will ever need You got gang violence And bloodshed on the street You got homeless people With no food to eat With no clothes on their back And no shoes for their feet We've got drug addiction In the minds of the weak We've got so much corruption Police brutality We've got streetwalkers Walking into darkness Tell me What are we doing To try to stop this?  (Why why) Why you wanna trip on me? (Why why why why) Why you wanna trip on me? (Why why why why) Why you wanna trip on me? (Why why why why) Why you wanna trip on me? (Why) Ooh stop trippin' Yeah stop trippin' Everybody just stop trippin'  (Why why) Why you wanna trip on me? (Why why why why) Why you wanna trip on me? (Why why why why) Why you wanna trip on me? (Why why why why) Why you wanna trip on me? (Why) Stop trippin' Why you wanna trip on me? (Why why why why) Why you wanna trip on me? (Why why why why) Why you wanna trip on me? (Why why why why) Why you wanna trip on me? (Why) Ooh stop trippin' Yeah stop trippin' Everybody just stop trippin'  Stop trippin' Stop trippin' Stop trippin' Stop trippin'
Michael Jackson,Stranger In Moscow,I was wandering in the rain Mask of life feelin' insane Swift and sudden fall from grace Sunny days seem far away Kremlin's shadow belittlin' me Stalin's tomb won't let me be. Wish the rain would just let me.
Michael Jackson,Childhood,Have you seen my childhood? I'm searching for the world that I come from 'Cause I've been looking around In the lost and found of my heart No one understands me They view it as such strange eccentricities 'Cause I keep kidding 'round Like a child but pardon me  People say I'm not okay 'Cause I love such elementary things It's been my fate to compensate For the childhood I've never known  Have you seen my childhood? I'm searching for that wonder in my youth Like pirates in adventurous dreams Of conquest and kings on the throne  Before you judge me try hard to love me Look within your heart then ask Have you seen my childhood?  People say I'm strange that way 'Cause I love such elementary things It's been my fate to compensate For the childhood (Childhood) I've never known  Have you seen my childhood? I'm searching for that wonder in my youth Like fantastical stories to share The dreams I would dare watch me fly  Before you judge me try hard to love me The painful youth I've had  Have you seen my childhood?
Michael Jackson,I Wanna Be Where You Are,Can it be I stayed away too long? Did I leave your mind when I was gone? It's not my thing trying to get back But this time let me tell you where I'm at You don't have to worry 'cause I'm coming Back to where I should have always stayed And now I've learned the meaning to your story And it's enough love for me to stay  Can it be I stayed away too long? Did I leave your mind when I was gone? Well it's not my thing trying to get back But this time let me tell you where I'm at  I wanna wanna be where you are oh oh Anywhere you are oh oh I wanna wanna be where you are oh oh Everywhere you are oh  Please don't close the door to our future There's so many things we haven't tried I could love you better than I used to And give you all the love I have inside  I wanna wanna be where you are oh oh Any any anywhere you are oh oh I wanna wanna be where you are oh oh I gotta gotta be where you are oh oh  I wanna be I wanna be oh Yeah yeah baby now I wanna be I wanna be oh Ooh I wanna be I wanna be oh Na na yeah yeah I wanna be I wanna be oh  I wanna be I wanna be oh Na na baby I wanna be I wanna be oh I wanna be I wanna be oh Ooh ooh baby
Michael Jackson,A Place With No Name,As I drove across on the highway my jeep began to rock I didn't know what to do so I stopped Then got out and looked down I noticed I've got a flat So I walked out parked the car like sideways So I can find what I can fix. I felt a strange feeling like a mist so I walked down towards the end of the road And in the fog a woman appeared She said Don't you worry my friend I'll take care Take my hand I'll taken you there.
Michael Jackson,Break Of Dawn,Hold my hand feel the touch of your body cling to mine You and me making love all the way through another night I remember you and I walking through the park at night Kiss and touch nothing much let it blow just touch and go  Love me more never leave me alone by house of love.
