Artist Name,Song Name,Sum Lyrics
Eminem,The City,This city never sleeps I hear the people walk by when it's late Sirens bleed through my windowsill I can't close my eyes Don't control what I'm into This tower is alive The lights that blind keep me awake My hood up and lace untied Sleep fills my mind Don't control what I'm into  London calls me a stranger A traveler This is now my home my home I'm burning on the back street Stuck here sitting in the backseat I'm blazing on the street What I do isn't up to you And if the city never sleeps Then that makes two  The pavement is my friend Hey and it will take me where I need to go I find it trips me up And puts me down This is not what I'm used to The shop across the road Fulfills my needs and gives me company When I need it Voices speak through my walls I don't think I'm gonna make it Past tomorrow  London calls me a stranger A traveler This is now my home my home I'm burning on the back street Stuck here sitting in the backseat I'm blazing on the street What I do isn't up to you And if the city never sleeps Then that makes two  And my lungs hurt And my ears bled With the sound of the city life Echoed in my head Do I need this to keep me alive? The traffic stops and starts But I need to move along  I'm from a city where the rain won't sleep Pollution in the air matches that on the street The black smoke Gets your head into a muddle like Walking into elephants Syringes in a puddle like I was a country boy when I moved out Grew up too fast for my family to find out Now I try to stop my music running into nose dives Can't resort to arrogance With white lies This city wants to raise me But I can't help but see just How this dark city changed me It's all the same see Music is my life but Now I try to fight Whatever I need to hide from North South East West London's my home now Knees weak but we never slow down Now I start to do my music properly I'll stay away from all the negative shit That will follow me  London calls me a stranger This is not my home home I'm burning on the back street Stuck here sitting in the backseat I'm blazing on the street What I do isn't up to you And if the city never sleeps Then that makes two,fear
Lana Del Rey,Freak,Flames so hot that they turn blue Palms reflecting in your eyes like an endless summer That's the way I feel for you If time stood still I'd take this moment make it last forever  Your halo's full of fire I'm rising up rising up My hot love's full of fire Love's full of fire La ah  Baby if you wanna leave come to California Be a freak like me too Screw your anonymity loving me is all you need To feel like I do We could slow dance to rock music kiss while we do it Talk 'til we both turn blue Baby if you wanna leave come to California Be a freak like me too  Leather black and eyes of blue (blue blue blue) Sun reflecting in your eyes like an easy rider Life makes sense when I'm with you Looking back my past It all seems stranger than a stranger  So let's dance in slow motion Tear it up tear it up Let's dance by the ocean Ah ah  Baby if you wanna leave come to California Be a freak like me too Screw your anonymity loving me is all you need To feel like I do We could slow dance to rock music kiss while we do it Talk 'til we both turn blue Baby if you wanna leave come to California Be a freak like me too  Ooh-ooh You're cold as ice baby But when you're nice baby You're so amazing in every way Ooh-ooh You're cold as ice baby I don't wanna fight baby It's like I told you If you stay I'll stay (yeah)  Baby if you wanna leave come to California Be a freak like me too (Take it to the back if you really wanna talk) Screw your anonymity loving me is all you need To feel like I do (Take it to the back if you really wanna talk) We could slow dance to rock music kiss while we do it Talk 'til we both turn blue Baby if you wanna leave come to California Be a freak like me too,fear
Lana Del Rey,God Knows I Tried,Sometimes I wake up in the morning To red blue and yellow skies It's so crazy I could drink it like tequila sunrise  Put on that Hotel California Dance around like I'm insane I feel free when I see no one And nobody knows my name  God knows I lived God knows I died God knows I begged Begged borrowed and cried God knows I loved God knows I lied God knows I lost God gave me life And God knows I tried God knows I tried God knows I tried God knows I tried  Sometimes I wake up in the morning To red blue and yellow lights On Monday they destroy me But by Friday I'm revived  Put on that Hotel California Wear my blinders in the rain I've got nothing much to live for Ever since I found my fame  God knows I lived God knows I died God knows I loved God knows I lied God knows I begged Begged borrowed and cried God knows I lost God gave me life And God knows I tried God knows I tried God knows I tried God knows I tried  So let there be light Let there be light Light up my life light up my life Let there be light let there be light Light up my life light up my life  And God knows I tried God knows I tried God knows I tried God knows I tried God knows I tried God knows I tried God knows I tried God knows I tried,fear
Lana Del Rey,Art Deco,Club queen on the downtown scene Prowling around at night You're not mean you're just born to be seen Born to be wild A little party never hurt no one that's why it's alright You want in but you just can't win So you hang in the lights  You're so Art Deco out on the floor Shining like gunmetal cold and unsure Baby you're so ghetto you're looking to score When they all say hello you try to ignore them  'Cause you want more (Why?) You want more (Why?) You want more (Why?) 'Cause you want more  Young thing on the downtown scene Rolling around at night Got things that have yet to be seen Like your rapper's delight A little party never hurt no one that's why it's alright You want in but you just can't win So you stay in the lights  You're so Art Deco out on the floor Shining like gunmetal cold and unsure Baby you're so ghetto you're looking to score When they all say hello you try to ignore them  'Cause you want more (Why?) You want more (Why?) You want more (Why?) 'Cause you want more  A little party never hurt no one So we stay out late A little party never hurt no one That's what your friends say You put your life out on the line You're crazy all the time Put your life out on the line You're crazy all the time  You're so Art Deco out on the floor Shining like gunmetal cold and unsure Baby you're so ghetto you're looking to score When they all say hello you try to ignore them  'Cause you want more (Why?) You want more (Why?) You want more (Why?) 'Cause you want more  A little party never hurt no one Not you and me A little party never hurt no one We were born to be free,fear
Maroon 5,Must Get Out,I've been the needle and the thread Weaving figure eights and circles 'round your head I try to laugh but cry instead Patiently wait to hear the words you've never said  Fumbling through your dresser drawer Forgot what I was looking for Try to guide me in the right direction Making use of all this time Keeping everything inside Close my eyes and listen to you crying  I'm lifting you up I'm letting you down I'm dancing 'til dawn I'm fooling around I'm not giving up I'm making your love This city's made us crazy and we must get out Oh yeah  This is not goodbye she said It is just time for me to rest my head She does not walk she runs instead Down these jagged streets and into my bed  When I was fumbling through your dresser drawer Forgot what I was looking for Try to guide me in the right direction Making use of all this time Keeping everything inside Close my eyes and listen to you crying  I'm lifting you up I'm letting you down I'm dancing 'til dawn I'm fooling around I'm not giving up I'm making your love This city's made us crazy and we must get out  There's only so much I can do for you oh After all of the things you put me through oh  I'm lifting you up I'm letting you down I'm dancing 'til dawn I'm fooling around I'm not giving up I'm making your love This city's made us crazy and we must get out  I'm lifting you up I'm letting you down I'm dancing 'til dawn I'm fooling around I'm not giving up I'm making your love This city's made us crazy and we must get out  (Whoa) I'm lifting you up (Oh) I'm letting you down (Whoa) I'm dancing 'til dawn I'm fooling around (Whoa) I'm not giving up (Whoa) I'm making your love (Yeah) This city's made us crazy and we must get out,fear
Maroon 5,This Love,I was so high I did not recognize The fire burning in her eyes The chaos that controlled my mind Whispered Goodbye as she got on a plane Never to return again But always in my heart oh  This love has taken its toll on me She said Goodbye too many times before And her heart is breaking in front of me And I have no choice 'cause I won't say Goodbye anymore  Whoa oh oh Whoa oh oh Whoa oh oh oh  I tried my best to feed her appetite Keep her coming every night So hard to keep her satisfied oh Kept playing love like it was just a game Pretending to feel the same Then turn around and leave again But I know  This love has taken its toll on me She said Goodbye too many times before And her heart is breaking in front of me And I have no choice 'cause I won't say Goodbye anymore  Whoa oh oh Whoa oh oh Whoa oh oh oh  I'll fix these broken things Repair your broken wings And make sure everything's alright (It's alright it's alright) My pressure on your hips Sinking my fingertips Into every inch of you 'Cause I know that's what you want me to do  This love has taken its toll on me She said Goodbye too many times before Her heart is breaking in front of me And I have no choice 'cause I won't say Goodbye anymore  This love has taken its toll on me She said Goodbye too many times before And my heart is breaking in front of me She said Goodbye too many times before  This love has taken its toll on me (Oh yeah yeah) She said Goodbye too many times before (Yeah) And her heart is breaking in front of me (Yeah) And I have no choice 'cause I won't say Goodbye anymore  This love has taken its toll on me,fear
Maroon 5,Unkiss Me,If you respect me don't protect me You can tell me; I can handle it Stop pretending 'cause we're going down If you let go then just let go It's disrespectful how you've handled this Never ending kinda run around  I lied to my heart 'cause I thought you felt it You can't light a fire if the candle's melted No you don't have to love me if you don't wanna Don't act like I mean nothing but if you're gonna Well then you better  Un-kiss me un-touch me Un-take this heart And I'm missing just one thing A brand new start  Can't erase this can't delete this I don't need this I can't handle it I just feel it that you're over us Oh if I wait here if I see you It won't matter what's the point of this? We're in pieces because you're over us ooh  I lied to my heart 'cause I thought you felt it You can't light a fire if the candle's melted No you don't have to love me if you don't wanna Don't act like I mean nothing but if you're gonna Well then you better  Un-kiss me un-touch me Un-take this heart And I'm missing just one thing A brand new start  So un-kiss me So un-kiss me Yeah yeah  So baby let go gotta let go It's disrespectful I can't handle this Never ending kinda run around Yeah yeah  Un-kiss me (Un-kiss me) Un-touch me (Oh) Un-take this heart Oh-oh-oh-oh I'm missing (I'm missing) Just one thing A brand new start (Yeah)  So un-kiss me (Oh oh oh-yeah-yeah-yeah oh oh) So un-kiss me (Oh oh oh-yeah-yeah-yeah oh oh) Un-kiss me,fear
Maroon 5,If I Never See Your Face Again,Now as the summer fades I let you slip away You say I'm not your type but I can make you sway It makes you burn to learn you're not the only one I'd let you be if you put down your blazing gun  Now you've gone somewhere else far away I don't know if I will find you (Find you find you) But you feel my breath on your neck Can't believe I'm right behind you (Right behind you)  'Cause you keep me coming back for more And I feel a little better than I did before If I never see your face again I don't mind 'Cause we got much further than I thought we'd get tonight  Sometimes you move so well it's hard not to give in I'm lost I can't tell where you end and I begin It makes me burn to learn you're with another man I wonder if he's half the lover that I am  Now you've gone somewhere else far away I don't know if I will find you (Find you find you) But you feel my breath on your neck Can't believe I'm right behind you (Right behind you)  'Cause you keep me coming back for more And I feel a little better than I did before If I never see your face again I don't mind 'Cause we got much further than I thought we'd get tonight  Baby baby please believe me Find it in your heart to reach me Promise not to leave me behind (Promise not to leave me behind) Take me down but take it easy Make me think but don't deceive me Torture me by taking your time (Talk to me talk to me)  'Cause you keep me coming back for more And I feel a little better than I did before And if I never see your face again I don't mind 'Cause we got much further than I thought we'd get tonight (Torture me yeah torture me)  Keep me coming back for more (Coming back for more) And I feel a little better than I did before If I never see your face again I don't mind 'Cause we got much further than I thought we'd get tonight,fear
Maroon 5,Won't Go Home Without You,I asked her to stay But she wouldn't listen And she left before I had the chance to say oh The words that would mend The things that were broken But now it's far too late she's gone away  Every night you cry yourself to sleep Thinking Why does this happen to me? Why does every moment have to be so hard? Hard to believe that  It's not over tonight Just give me one more chance to make it right I may not make it through the night I won't go home without you  The taste of her breath I'll never get over The noises that she made kept me awake oh The weight of the things That remained unspoken Built up so much it crushed us every day  Every night you cry yourself to sleep Thinking Why does this happen to me? Why does every moment have to be so hard? Hard to believe that  It's not over tonight Just give me one more chance to make it right I may not make it through the night I won't go home without you Oh-whoa-oh-oh It's not over tonight Just give me one more chance to make it right I may not make it through the night I won't go home without you Oh-whoa-oh-oh  Of all the things I felt but never really showed Perhaps the worst is that I ever let you go I should not ever let you go oh-oh-oh  It's not over tonight Just give me one more chance to make it right I may not make it through the night I won't go home without you Oh-whoa-oh-oh It's not over tonight Just give me one more chance to make it right I may not make it through the night I won't go home without you  And I won't go home without you And I won't go home without you And I won't go home without you,fear
Maroon 5,Lost Stars,Please don't see Just a boy caught up in dreams and fantasies Please see me Reaching out for someone I can't see  Take my hand let's see where we wake up tomorrow Best laid plans sometimes are just a one night stand I'll be damned Cupid's demanding back his arrow So let's get drunk on our tears  And God tell us the reason youth is wasted on the young It's hunting season and the lambs are on the run Searching for meaning But are we all lost stars trying to light up the dark?  Who are we? Just a speck of dust within the galaxy? Woe is me If we're not careful turns into reality  But don't you dare let our best memories bring you sorrow Yesterday I saw a lion kiss a deer Turn the page maybe we'll find a brand new ending Where we're dancing in our tears  And God tell us the reason youth is wasted on the young It's hunting season and the lambs are on the run Searching for meaning But are we all lost stars trying to light up the dark?  And I thought I saw you out there crying And I thought I heard you call my name And I thought I heard you out there crying Just the same  And God give us the reason youth is wasted on the young It's hunting season and this lamb is on the run Searching for meaning But are we all lost stars trying to light ... light up the dark?  And I thought I saw you out there crying And I thought I heard you call my name And I thought I heard you out there crying But are we all lost stars trying to light up the dark? Are we all lost stars trying to light up the dark?,fear
Maroon 5,Sunday Morning,Yeah  Sunday morning rain is falling Steal some covers share some skin (Like that) Clouds are shrouding us in moments unforgettable You twist to fit the mold that I am in  But things just get so crazy living life gets hard to do (Life is hard) And I would gladly hit the road get up and go if I knew That someday it would lead me back to you That someday it would lead me back to you (Someday)  That may be all I'll need In darkness she is all I see (All I see) Come and rest your bones with me Driving slow on Sunday morning And I never want to leave  (Yeah) Fingers trace your every outline (Oh yeah yeah) (Yeah) Paint a picture with my hands (Oh oh whoa) And back and forth we sway like branches in a storm Change the weather still together when it ends  That may be all I need (All I need) In darkness she is all I see Come and rest your bones with me Driving slow on Sunday morning And I never want to leave Yeah  Oh yeah But things just get so crazy living life gets hard to do (Life gets hard) Sunday morning rain is falling and I'm calling out to you Singing someday it'll bring me back to you yeah (Someday oh someday oh) Find a way to bring myself back home to you  You may not know That may be all I need (All I need) In darkness she is all I see (You are all I see) Come and rest your bones with me Driving slow on Sunday morning Driving slow yeah yeah Ah yeah yeah Ah yeah yeah Ah yeah yeah Ah yeah yeah Ah yeah yeah  There's a flower in your hair I'm a flower in your hair Oh yeah yeah Yeah yeah oh Whoa oh yeah Woo (All I need) Yeah yeah (All I see) Yeah (Bones with me) Yeah yeah yeah yeah yeah (All I need) (All I see),fear
Michael Jackson,You Can't Win,You can't win you can't break even And you can't get out of the game People keep saying things are going to change But they look just like they're staying the same You can't win way over your head And you only have yourself to blame  [Michael Jackson:] You can't win chile You can't break even And you can't get out of the game  [Michael Jackson (The Crows):] You can't win the world keeps moving And you're standing far behind People keep saying things will get better (Just to ease your state of mind) (So you lean back) (And you smoke that smoke) (And you drink your glass of wine)  Sayin' you can't win chile You can't break even And you can't get out of the game  You can't win you can't win no way If your story stays the same (You ain't winning) No no (But it's nice to see you I'm awfully glad you came) (Better cool it cause it ain't about losin') Then the world has got no shame  You can't win chile You can't break even And you can't get out of the game  You can't win you can't break even Ain't the way it's supposed to be (You'll be spending) No no oh (Your little bit of money) While someone else rides for free (Learn your lesson) Hoo-hoo! (Refuel your mind before some turkey blows out your flame)  You can't win chile (No you can't win) (No you can't win) (No you can't win) (No you can't win)  You can't win chile You can't break even And you can't get out of the game You can't get out of the game You can't get out a-hoooooo! You can't get out of the game now hah! No no ah d'ah,fear
Michael Jackson,She Drives Me Wild,She's got the look she's so fine And you know damn well the girl will be mine  She's got the breaks she's the scene And you know damn well she gives it to me Uh-huh! Black jeans and a turtleneck sweater I know the girl is fakin' 'Cause I've seen her look better  She's composition she's statistical fact Got it ready for the willing Got it kicking in the back  She's got the look She's got the look I wanna know her better She's got the look She's got the look She's driving me wild  She's got the look I wanna know her better She's got the look She's driving me wild  Come to the place shock to see And you know damn well you know what I mean  Hot in the face one to three Like a pleasure trip like you've never seen  Uh-huh!  Satin lace and a paisley cut top The girl is wasting over And she knows she looks hot  She's got position She's got just what it takes Got a mojo in her pocket Got it ready just in case  She's got the look I wanna know her better She's got the look She's driving me wild  She's got the look I wanna know her better She's got the look She's driving me wild  Please no keep back I can't take it You're drivin' me wild I might not make it Uh-huh! You got me lookin' like buckwheat oh Hair pulled every which way but me Uh-huh! Far from Medusa but your looks are deadly You walk is soft still I hear the medley Uh-huh! Shiver my Timberland boots cramp my style She drives me wild  She's got the look She's got the look She's got the look  She's got the look She's got the look I wanna know her better She's got the look She's driving me wild  [Repeat with ad-libs until the end:] She's got the look I wanna know her better She's got the look She's driving me wild,fear
Michael Jackson,Too Young,They try to tell us we're too young Too young to really be in love  They say that love's a word A word we've only heard But can't begin to know the meaning of  And yet we're not too young to know This love will last though years may go  And then someday they may recall We were not too young at all  They try to tell us we're too young Too young to really be in love  And yet we're not too young to know This love will last though years may go And then someday they may recall We were not too young at all,fear
Michael Jackson,Blood On The Dance Floor,She got your number ah She know your game ah She put you under ah It's so insane ah Since you seduced her ah How does it feel? Ah To know that woman ah Is out to kill  Every night stance is like taking a chance It's not about love and romance And now you're gonna get it.,fear
Michael Jackson,In The Back,You're just preaching the Bible And they still speaking You're a liar And you still deal with the fires That they make get bigger Dah dah dah dah dah dah  Dah dah dah dah dah dah and you Dah dah dah dah dah dah dah dah Dah dah dah dah dah dah Dah dah dah dah dah  Why you wanna get me? Dreams don't last forever oh Why you wanna fix me? See if the police don't take it God forsake it I can't take it  Why you stab me in the back?  We're so gonna lose it And she knows that is the deal She I Dah dah dah dah dah Dah dah dah dah Dah dah dah dah dah dah dah  Dah dah dah dah people Dah dah dah dah dah dah dah Dah dah dah dah did I Dah dah dah dah  Why you wanna get me? This dude won't last forever Why you wanna hit me? Oh babe If the police don't take it God forsake it I'll fall breaking  Why you stab me in the back?  Why you wanna fix me? Things don't last forever oh no Why you wanna get me? We should be together Why you wanna hit me? We should be together Why you wanna get me? See if the police don't take it God forsake it I won't take it  Why you stab me in the back?  Ow!,fear
Michael Jackson,D.S.,Aaow! Gone babe  Ah they wanna get my ass dead or alive ah You know he really tried to take me down by surprise I bet he missioned with the CIA dah I bet his mother never taught him right anyway He want your vote just to remain TA ah He don't do half what he say ,fear
Michael Jackson,Invincible,Michael Jackson: If I could tear down these walls that keep you and I apart I know I could claim your heart and our perfect love will start I'll be showing you what other men are supposed to do for you my baby The way you resisting this ain't cool It's like nothing seems to work she's invincible,fear
Michael Jackson,Billie Jean,She was more like a beauty queen From a movie scene I said Don't mind but what do you mean I am the one Who will dance on the floor in the round? She told me her name was Billie Jean As she caused a scene Then every head turned with eyes that dreamed of being the one. People always told me Be careful of what you do. And don't go around breaking young girls' hearts.,fear
