Artist Name,Song Name,Sum Lyrics
Michael Jackson,Superfly Sister,Hee-hee! Show me Hoo! Oh oh Hee!  Love ain't what it used to be That is what they're tellin' me Push it in stick it out That ain's what it's all about (Oh)  Susie like to agitate Get the boy and make him wait Mother's preachin' Abraham Brothers they don't give a damn (Oh!)
Michael Jackson,The Way You Make Me Feel,Hee-hee Ooh G'on girl! Aaow! Hee  Hey pretty baby with the high heels on You give me fever like I've never ever known You're just a product of loveliness. I'll pick you up in my car and we'll paint the town Just kiss me baby and tell me twice That you're the one for me.
Michael Jackson,We've Got Forever,(We've got forever forever)  I'll plant you a garden Of laughter and tears With rain and with sunshine Love will grow through the years The dreams that we're dreaming Have time to come true  'Cause we've got forever And forever is meant for so very few  We shall have music We shall have rhyme We shall have each other One minute after the end of time  Then we'll add up the pleasures And treasure the sums Caring is sharing The cake and the crumbs How lucky we are to be me and you  'Cause we've got forever And forever is meant for so very few  (We got we got we got we got it) Me and you baby (We got we got we got) (Forever and forever) (We got we got we got ooh) (We got we got we got) We got a million tomorrows (We got we got we got we got it) Uh yeah  (We got we got we got) (Forever and forever) Yeah (We got we got we got ooh) I know that we got it (We got we got we got) I know that we got it (We got we got we got we got it) Ah  (We got we got we got) (Forever and forever) We've got we've got we've got (We got we got we got ooh) Got got yeah (We got we got we got) Uh yeah (We got we got we got we got it) Me and you baby  (We got we got we got) (Forever and forever) Uh (We got we got we got ooh) (We got we got we got) We got a million tomorrows (We got we got we got we got it)  (We got we got we got) (Forever and forever) (We got we got we got ooh) (We got we got we got)
Michael Jackson,Got To Be There,Got to be there (Got to be there) Got to be there in the morning When she says hello to the world Got to be there (Got to be there) Got to be there bring her good times And show her that she's my girl  Oh what a feeling there'll be The moment I know she loves me 'Cause when I look in her eyes I realise I need her sharing her world beside me  So I've got to be there (Got to be there) Got to be there in the morning And welcome her into my world And show her that she's my girl When she says Hello world! (Got to be there)  I need her sharing the world beside me  That is why I've got to be there (Got to be there) Got to be there where love begins And that's everywhere she goes I've got to be there so she knows That when she's with me She's home (Home she's home) (Home she's home) Yeah  (Got to be there) Got to be there got to be there (Got to be there) Got to be there got to be there (Got to be there) Oh baby baby got to be there got to be there (Got to be there) Got to be there oh to be there (Oh baby baby) (Got to be there) Oh got to be there got to be there (Got to be there) Oh got to be there got to be there (Got to be there) (Oh baby baby) Got to be there
Michael Jackson,Liberian Girl,[Swahili:] Naku penda pia Naku taka pia Mpenziwe [English translation: I love you too I want you too My love]  Liberian girl You came and you changed my world A love so brand new Liberian girl You came and you changed me girl A feeling so true  Liberian girl You know that you came and you changed my world Just like in the movies With two lovers in a scene And she says Do you love me? And he says So endlessly. I love you Liberian girl.  (Naku penda pia Naku taka pia Mpenziwe)  Liberian girl More precious than any pearl Your love so complete Liberian girl You kiss me then ooh the world You do this to me  Liberian girl You know that you came and you changed my world Just like in the movies With two lovers in a scene And she says Do you love me? And he says So endlessly. I love you Liberian girl.  (Naku penda pia Naku taka pia Mpenziwe)  Liberian girl You know that you came and you changed my world I wait for the day When you have to say I do And I'll smile and say it too And forever we'll be true I love you Liberian girl All the time  (girl) I love you Liberian girl All the time (girl) I love you Liberian girl All the time (girl) I love you Liberian girl All the time (girl) I love you I love you baby (girl) I want you I love you baby (girl) Ooh! I love you baby I want You baby ooh! (girl)
Michael Jackson,Best Of Joy,I am your joy your best of joy I am the moonlight you are the spring Our life's a sacred thing You know I always will love you I am forever  I am the one who came when you fell down I was the only one around (The only one) When things would hurt you I am forever Wasn't it I who said that you are free? When living seemed so hard to be When things would hurt you  I am forever (I am forever) We are forever (We are forever)  I am your friend through thick and thin We need each other we'll never part Our love is from the heart We never say I don't need you we are forever  I am the one who said that you are free When living seemed so hard to be (The only one) And nothing would cheer you I am forever Wasn't it I who carried you around? When all the walls came tumblin' down When things would hurt you  I am forever (I am forever) We are forever (We are forever)  You are the sun that lights up the sky When things are shady let come what may we do get by  I was the only one around (The only one) When things would hurt you  We are forever (I am forever alright) We are forever (I am forever uh-huh) We are forever (ah what you do? What ya' live for?) We are forever (What you do? What ya' live for? Our love is strong) We are forever (What you do? What ya' live for? Uh-huh) We are forever (Uh-huh alright) I am forever I am forever (Ah uh-huh alright) We are forever (Hoo-hoo) we are forever (Hee) I am forever I am forever
Michael Jackson,Euphoria,Love love love love Love love love love Love love love love Love love love love Euphoria euphoria Euphoria euphoria  E-U-P-H-O-R-I-A That's the new word for today E-U-P-H-O-R-I-A It is very easy to say  Say euphoria And you'll feel fine from the start You can close your eyes And see the world with your heart  Do what you wish be what you are What a victorious thrill Wearing a smile all of the while Feeling the world standing still  Watch rainbows glow Rest on a bed of flowers Then dial a star Anything's in your powers  E-U-P-H-O-R-I-A Full of v-vigour and vim Knowing no ills needing no pills Singing a rock and roll hymn  Feeling glorious full of love Fine from the start You can close your eyes And see the world with your heart  How good to be happy and free Living the way that you choose Healthy and clean Can't understand anyone having the blues  Euphoria Never to feel frustration How great to give Love without limitation  Euphoria euphoria Long as we love each other Euphoria euphoria Living for one another  Euphoria euphoria That's the new word for heaven Euphoria euphoria Living in love is heaven  Euphoria euphoria Long as we love each other Euphoria euphoria
Michael Jackson,Baby Be Mine,I don't need no dreams when I'm by your side ooh-ooh Every moment takes me to paradise Darling let me hold you I'll warm you in my arms and melt your fears away Show you all the magic that a perfect love can make I need you night and day. So baby be mine (Baby you got to be mine) ow And girl I'll give you all I got to give Sobaby be my girl (All the time)
Michael Jackson,Rockin' Robin,Tweedily deedily dee tweedily deedily dee Tweedily deedily dee tweedily deedily dee Tweedily deedily dee tweedily deedily dee Tweet tweet tweet tweet  He rocks in the tree tops all day long Hopping and a-bopping and singing his song All the little birdies on Jaybird Street Love to hear the robin go tweet tweet tweet  Rockin' robin rock rock Rockin' robin Blow rockin' robin 'Cause we're really gonna rock tonight  Every little swallow every chick-a-dee Every little bird in the tall oak tree The wise old owl the big black crow Flapping their wings singing Go bird go  Rockin' robin rock rock Rockin' robin Blow rockin' robin 'Cause we're really gonna rock tonight Yeah yeah!  Pretty little raven at the bird-band stand Taught him how to do the bop and it was grand They started going steady and bless my soul He out-bopped the Buzzard and the Oriole  He rocks in the tree tops all day long Hopping and a-bopping and singing his song All the little birdies on Jaybird Street Love to hear the robin go tweet tweet tweet  Rockin' robin (Tweet tweedily dee) rock rock Rockin' robin (Tweet tweedily dee) Blow rockin' robin 'Cause we're really gonna rock tonight  Pretty little raven at the bird-band stand Taught him how to do the bop and it was grand They started going steady and bless my soul He out-bopped the Buzzard and the Oriole  He rocks in the tree tops all day long Hopping and a-bopping and singing his song All the little birdies on Jaybird Street Love to hear the robin go tweet tweet tweet  Rockin' robin (Tweet tweedily dee) rock rock Rockin' robin (Tweet tweedily dee) Blow rockin' robin 'Cause we're really gonna rock tonight  Tweedily deedily dee tweedily deedily dee Tweedily deedily dee tweedily deedily dee Tweedily deedily dee tweedily deedily dee Tweet tweet
Michael Jackson,This Is It,Ready? One two three four  This is it here I stand I'm the light of the world I feel grand Got this love I can feel And I know yes for sure it is real  And it feels as though I've seen your face a thousand times And you said you really know me too yourself And I know that you have got addicted with your eyes But you say you gonna live it for yourself oh  I never heard a single word about you Falling in love wasn't my plan (My plan) I never thought that I would be your lover Come on baby just understand  This is it I can say I'm the light of the world runaway We can feel this is real Every time I'm in love that I feel  And I feel as though I've known you since a thousand years And you tell me that you've seen my face before And you said to me you don't want me hanging 'round Many times wanna do it here before oh yeah  I never heard a single word about you Falling in love wasn't my plan (My plan) I never thought that I would be your lover Come on baby just understand  This is it (This is it) I can feel (I can feel) I'm the light of the world this is real Feel my song we can say And I tell you I feel that way  And I feel as though I've known you for a thousand years And you said you want some of this yourself And you said you wanna go with me all the while And I know that it's really true myself oh yeah  I never heard a single word about you Falling in love wasn't my plan (My plan) I never thought that I would be your lover Come on please dear understand (Understand) Ah-ayy I never heard a single word about you Falling in love wasn't my plan (My plan) I never thought that I would be your lover Come on please dear understand (Understand)  Never heard a single word about you Falling in love wasn't my plan
Michael Jackson,Cinderella Stay Awhile,Fairytale make believe in you Fairytale make believe in you  Cinderella stay awhile You're the one That I've been lookin' for Cinderella when you smile All around me sunbeams Start to fall  Midnight is so near Please don't disappear Now that you are here Stay awhile  Cinderella I just know That the magic slipper's Gonna fit Cinderella do not go You're my princess I am sure of it  This is love for sure Love that's sweet and pure Love that will endure Stay awhile  When you speak the angels all sing This is the kind of magic you bring oh  Cinderella stay awhile This is like a fairytale with you Cinderella when you smile All my fairy tales are coming true  Well my only fear Is midnight is so near Please don't disappear Stay awhile oh  (Fairy tales make-believe and you) (Fairy tales make-believe and you)  Cinderella stay awhile Don't you go Oh
One Direction,Live While We're Young,Zayn: We'll be doing what we do Just pretending that we're cool and we know it too (know it too) Liam: Hey girl I'm waiting on ya let me sneak you out And have a celebration a celebration The music up the windows down  [Zayn:] And live while we're young.
Ariana Grande,Be My Baby,Yeah baby Ooh babe mm  If you know how to be my lover Maybe you can be my baby Hold me close under the covers Kiss me boy and drive me crazy Be my be my be my be my be my baby Be my be my be my baby and drive me crazy  If you know how to treat me you know how to touch me Baby then you'll get the chance the chance to love me It's obvious I want to be into you But it all depends on all the things you do 'Cause babe I promise I promise If you keep it real with me be honest be honest You can get anything you want that you want babe Just show me everything I need to see I'll give you anything boy  If you know how to be my lover Maybe you can be my baby Hold me close under the covers Kiss me boy and drive me crazy Be my be my be my be my be my baby Be my be my be my baby and drive me  I'll give you all of my trust if you don't mess this up You ain't tryna get no other girls when you in the club All you got is eyes for me I'm the only girl you see So if you treat me right just the way that I want you Oh baby boy I promise that I'll be on you Oh-oh on you Night to the morning  If you know how to be my lover Maybe you can be my baby Hold me close under the covers Kiss me boy and drive me crazy Be my be my be my be my be my baby Be my be my be my baby and drive me crazy  Hey I'll give you all of my trust if you don't mess this up You ain't tryna get no other girls when you in the club All you got is eyes for me I'm the only one you see  If you know how to be my lover (Be my) Maybe you can be my baby (By my side) Hold me close under the covers (Hey) Kiss me boy and drive me crazy (Crazy baby yeah) Be my be my be my be my be my baby Be my be my be my baby and drive me crazy  Mm-mm yeah ay mm,joy
Ariana Grande,Intro,I'll give you all I have And nothing less I promise Love me and don't look back I want you with me on this road to the sky We'll be shining every night I promise you Just me and you Oh I promise you,joy
Ariana Grande,Problem,"Ariana Grande: ""Even though I shouldn't want it I gotta have it I want you!  Head in the clouds Got no weight on my shoulders I should be wiser And realize that I've got"" Big Sean: ""One less problem without ya! I got! One less problem with you girl One less one less!""",joy
Coldplay,Politik,Look at earth from outer space Everyone must find a place Give me time and give me space Give me real don't give me fake  Give me strength reserve control Give me heart and give me soul Give me time give us a kiss Tell me your own politik  And open up your eyes Open up your eyes Open up your eyes Open up your eyes  Give me one 'cause one is best In confusion confidence Give me peace of mind and trust Don't forget the rest of us  Give me strength reserve control Give me heart and give me soul Wounds that heal and cracks that fix Tell me your own politik  And open up your eyes Open up your eyes Open up your eyes Open up your eyes Just open up your eyes  But give me love over love over love over this I But give me love over love over love over this I,joy
Eminem,Galway Girl,She played the fiddle in an Irish band But she fell in love with an English man Kissed her on the neck and then I took her by the hand Said Baby I just want to dance  With my pretty little Galway Girl. She beat me at darts and then she beating me at pool And then she kissed me like there was nobody else in the room As last orders were called was when she stood on the stool After dancing to Cèilidh singing to trad tunes I never heard Carrickfergus ever sung so sweet.,joy
Lana Del Rey,Pretty When You Cry,All the pretty stars shine for you my love Am I that girl that you dream of? All those little times you said that I'm your girl You make me feel like your whole world  I'll wait for you babe That's all I do babe Don't come through babe You never do  Because I'm pretty when I cry I'm pretty when I cry I'm pretty when I cry I'm pretty when I cry  All those special times I spent with you my love They don't mean shit compared to all your drugs But I don't really mind I've got much more than that Like my memories I don't need that  I wait for you babe You don't come through babe You never do babe That's just what you do  Because I'm pretty when I cry I'm pretty when I cry I'm pretty when I cry I'm pretty when I cry  Don't say you need me when You leave and you leave again I'm stronger than all my men Except for you Don't say you need me if You know that you're leaving I can't do it I can't do it But you do it well  'Cause I'm pretty when I cry I'm pretty when I cry I'm pretty when I cry I'm pretty when I cry I'm pretty when I cry I'm pretty when I cry I'm pretty when I cry I'm pretty when I cry,joy
Lana Del Rey,Video Games,Swinging in the backyard Pull up in your fast car Whistling my name  Open up a beer And you say Get over here And play a video game.  I'm in his favorite sundress Watching me get undressed Take that body downtown  I say You the bestest. Lean in for a big kiss Put his favorite perfume on  Go play a video game  It's you it's you it's all for you Everything I do I tell you all the time Heaven is a place on earth with you Tell me all the things you wanna do I heard that you like the bad girls Honey is that true? It's better than I ever even knew They say that the world was built for two Only worth living if somebody is loving you Baby now you do  Singing in the old bars Swinging with the old stars Living for the fame  Kissing in the blue dark Playing pool and wild darts Video games  He holds me in his big arms Drunk and I am seeing stars This is all I think of  Watching all our friends fall In and out of Old Paul's This is my idea of fun Playing video games  It's you it's you it's all for you Everything I do I tell you all the time Heaven is a place on earth with you Tell me all the things you wanna do I heard that you like the bad girls Honey is that true? It's better than I ever even knew They say that the world was built for two Only worth living if somebody is loving you Baby now you do  Now you do Now you do Now you do  Now now you do Now you do Now you do  It's you it's you it's all for you Everything I do I tell you all the time Heaven is a place on earth with you Tell me all the things you wanna do I heard that you like the bad girls Honey is that true? It's better than I ever even knew They say that the world was built for two Only worth living if somebody is loving you Baby now you do  Now now you do Now you do Now you do (Now you do) Now now you do Now you do Now you do,joy
Michael Jackson,Leave Me Alone,Aaow! Hoo-hoo!  I don't care what you talkin' 'bout baby. ('Cause there's a time when you're right And you know you must fight) Who's laughin' baby? Don't you know (And there's the choice that we make And this choice you will take) So just leave me alone girl (Leave me alone),joy
Michael Jackson,Dear Michael,She wrote: Dear Michael You'll probably never get this letter Michael I wrote you a hundred times before Knowing how I feel I'll write a hundred more  Dear Michael (Michael Michael) Every time (She wrote) your record's on Michael (Michael Michael) I close my eyes (She wrote) and sing along Dreaming you're singing to me  And then she wrote: Michael I love you I've held the tears back long as I can I'm sealing my feelings in this envelope 'Cause I wanna be more than just your number one fan  I'm gonna answer your letter (Michael Michael) I'll start beginning (She wrote) with the ABC's of loving you (Michael Michael) Your letter (She wrote) really touched my heart I've been dreaming of Meeting the picture that you sent along Signed with all your love  (Michael Michael) (I wrote you) (She wrote) I'm gonna write you back ooh I promise you that  Girl I think I love you (Michael Michael) (I wrote you she wrote) Hurry hurry mister postman (Won't you write me back?) (Please write me back) Take my letter tell her I love her (Michael Michael) (I wrote you she wrote) Hurry hurry mister postman (Won't you write me back?) (Please write me back) Take my letter tell her I love her (Michael Michael) Yeah (I wrote you) (She wrote) I'm gonna write you back I promise you that Tell her I love her  (Ouch),joy
Michael Jackson,This Time Around,This time around I'm not gon' get bit Though you really wanna get me I really thought he really had a hold of me (Guilt me and deal with me I like the way you thrill me) I'm hopin' a fool come slippin' so I can blow him open,joy
Michael Jackson,Up Again,Into each life some rain falls Then comes the snow But after the snow The flowers will grow Girl when my life got stormy You stayed for the ride You stayed by my side You make the sun shine  I'm up again I never let you down Nothing's ever gonna stop me now Up again I never let you down I love you  This Humpty Dumpty's lucky He's had his fall But after it all He brushed himself off Knowing how much you loved me I made one more try I reached for the sky And I made it this time  I'm up again I never let you down Nothing's ever gonna stop me now Up again I never let you down I love you,joy
Michael Jackson,Off The Wall,When the world is on your shoulder Gotta straighten up your act and boogie down If you can't hang with the feelin' Then there ain't no room for you in this part of town 'Cause we're the party people night and day Livin' crazy that's the only way. So tonight gotta leave that nine to five upon the shelf And just enjoy yourself Groove let the madness in the music get to you Life ain't so bad at all (Live life off the wall),joy
One Direction,C'mon, C'mon(Come on come on)  [Zayn:] The one that I came with She had to go But you look amazing Standing alone  So come on come on  [Louis:] Move a little closer now  [Liam:] Come on come on  [Louis:] Ain't no way you're walkin' out  [Liam:] Come on come on  [Harry:] Show me what you're all about  [All:] Yeah I been watching you all night There's something in your eyes Saying come on come on and dance with me baby Yeah The music is so loud I wanna be yours now So come on come on and dance with me baby  [Niall:] The one that I came with Didn't know how to move The way that you let your hair down I can tell that you do  So come on come on  [Louis:] Move a little closer now  [Liam:] Come on come on  [Louis:] Ain't no way you're walking out  [Liam:] Come on come on  [Harry:] Show me what you're all about  [All:] Yeah I been watching you all night There's something in your eyes Saying come on come on and dance with me baby Yeah The music is so loud I wanna be yours now So come on come on and dance with me baby  Every step I take I feel it more and more She's calling out She's looking good My heart is racing She's turning around I reach for her hand and I say  [Zayn:] Hey I been watching you all night  [All:] There's something in your eyes Saying come on come on and dance with me baby Yeah The music is so loud I wanna be yours now So come on come on and dance with me baby  Oooh Come on come on Oooh Come on come on Oooh Come on come on And dance with me baby,joy
One Direction,Rock Me,[Harry:] Do you remember summer '09 Wanna go back there every night Just can't lie it was the best time of my life Lying on the beach as the sun blew out Playing this guitar by the fire too loud Oh my my they can never shut us down  [Louis:] I used to think that I was better alone Why did I ever wanna let you go Under the moonlight as we stared at the sea The words you whispered I will always believe  [Niall:] I want you to Rock me rock me rock me... yeah! I want you to Rock me rock me rock me... yeah! I want you to Hit the pedal heavy metal show me you care I want you to Rock me rock me rock me... yeah!  [Liam:] (Yeah) We were together summer '09 Wanna roll back like pressing rewind You were mine and we never said goodbye  [Louis:] I used to think that I was better alone (better alone) Why did I ever wanna let you go (let you go) Under the moonlight as we stared at the sea (stared at the sea) The words you whispered I will always believe  [Niall:] I want you to Rock me rock me rock me... yeah! I want you to Rock me rock me rock me... yeah! I want you to Hit the pedal heavy metal show me you care I want you to Rock me rock me rock me... yeah!  [Niall/Liam:] R-O-C-K me again R-O-C-K me again R-O-C-K me again... yeah I want you to R-O-C-K me again R-O-C-K me again R-O-C-K me again... yeah  [Niall:] I want you to Rock me rock me rock me... yeah! I want you to Rock me rock me rock me... yeah! I want you to Hit the pedal heavy metal show me you care I want you to Rock me rock me rock me... yeah!  I want you to Rock me rock me rock me... yeah! I want you to Rock me rock me rock me... yeah! I want you to Hit the pedal heavy metal show me you care I want you to Rock me rock me rock me... yeah!,joy
