Artist Name,Song Name,Sum Lyrics
Ed Sheeran,I'm Shady,I'm Shady is a song by rapper Slim Shady. The song was released in 2007. The single was the number-one club hit in New York City. I like happy things I'm really calm and peaceful (Uh-huh) I like birds bees I like people the song says.
Eminem,Happier,Walking down 29th and park I saw you in another's arms Only a month we've been apart You look happier  Saw you walk inside a bar He said something to make you laugh I saw that both your smiles were twice as wide as ours Yeah you look happier you do  Ain't nobody hurt you like I hurt you But ain't nobody love you like I do Promise that I will not take it personal baby If you're moving on with someone new  Cause baby you look happier you do My friends told me one day I'll feel it too And until then I'll smile to hide the truth But I know I was happier with you  Sat in the corner of the room Everything's reminding me of you Nursing an empty bottle and telling myself you're happier Aren't you?  Ain't nobody hurt you like I hurt you But ain't nobody need you like I do I know that there's others that deserve you But my darling I am still in love with you  But I guess you look happier you do My friends told me one day I'll feel it too I could try to smile to hide the truth But I know I was happier with you  Baby you look happier you do I knew one day you'd fall for someone new But if he breaks your heart like lovers do Just know that I'll be waiting here for you
Eminem,Hearts Don't Break Around Here,She is the sweetest thing that I know You should see the way she holds me when the lights go low Shakes my soul like a pot hole every time Took my heart upon a one way trip Guess she went wandering off with it Unlike most women I know This one will bring it back whole Daisies daisies perched upon your forehead Oh my baby lately I know  That every night I'll kiss you you'll say in my ear Oh we're in love aren't we? Hands in your hair fingers and thumbs baby I feel safe when you're holding me near Love the way that you conquer your fear You know hearts don't break around here Oh yeah yeah yeah  yeah yeah yeah yeah  She is the river flow in Orwell And tin wind chimes used for doorbells Fields and trees and her smell fill my lungs Spent my summer time beside her And the rest of the year the same She is the flint that sparks the lighter And the fuel that will hold the flame Oh roses roses laid upon your bed spread Oh my hold this oh this I know  That every night I'll kiss you you'll say in my ear Oh we're in love aren't we? Hands in your hair fingers and thumbs baby I feel safe when you're holding me near Love the way that you conquer your fear You know hearts don't break around here Oh yeah yeah yeah  Well I found love in the inside The arms of a woman I know She is the lighthouse in the night that will safely guide me home And I'm not scared of passing over Or the thought of growing old Because from now until I go  Every night I'll kiss you you'll say in my ear Oh we're in love aren't we? Hands in your hair fingers and thumbs baby I feel safe when you're holding me near Love the way that you conquer your fear You know hearts don't break around here Oh yeah yeah  Every night I'll kiss you you'll say in my ear Oh we're in love aren't we? Hands in your hair fingers and thumbs baby I feel safe when you're holding me near Love the way that you conquer your fear You know hearts don't break around here Yeah yeah yeah You know hearts don't break around here Oh yeah yeah yeah yeah
Eminem,So,Filled up with doubt I have to move home But I want to stay with you For all of the summer I have my plan That you won't remember If you want to see the world Then please ask your mother  I cannot hold your hand To watch you go I am a liar As you might know I need you now I need your touch And your lips I need that smile [Acoustic version:] I need your smile And your kiss  [2x] You're so cool You're so beautiful You're so You're so  I see your grace From my window When it is late at night It'll show me your shadow I'm in my place Hope you remember When summer's gone I'll still sing a song Of you in September  [Acoustic version's verse:] I see your voice From my window When it is late at night It'll show me your shadow I have my plan But you won't remember it But if you want to see the world Then please ask your mother  I cannot hold your hand To watch you go I am a liar As you might know I need you now I need your touch And your lips I need that smile [Acoustic version:] I need your smile And your kiss  [2x] You're so cool You're so beautiful You're so You're so  [2x] These words I say mean You're so amazing And I've noticed lately I need you maybe  'Cause you're so cool You're so beautiful You're so You're so
Eminem,Tenerife Sea,You look so wonderful in your dress I love your hair like that The way it falls on the side of your neck Down your shoulders and back  We are surrounded by all of these lies And people who talk too much You got the kind of look in your eyes As if no one knows anything but us  Should this be the last thing I see I want you to know it's enough for me 'Cause all that you are is all that I'll ever need  I'm so in love so in love So in love so in love  You look so beautiful in this light Your silhouette over me The way it brings out the blue in your eyes Is the Tenerife Sea  And all of the voices surrounding us here They just fade out when you take a breath Just say the word and I will disappear Into the wilderness  Should this be the last thing I see I want you to know it's enough for me 'Cause all that you are is all that I'll ever need  I'm so in love so in love So in love so in love  Lumière darling Lumière over me  Lumière darling Lumière over me  Lumière darling Lumière over me  Should this be the last thing I see I want you to know it's enough for me 'Cause all that you are is all that I'll ever need  I'm so in love so in love So in love love love love So in love  You look so wonderful in your dress I love your hair like that And in a moment I knew you Beth
Eminem,Family,I've had serious madness is where I've nearly disappeared I just want you to take a second hear me out. Don't think I'm happy 'cause I smile when you see me out You can have a sicker clan than Wu-Tang But when your time's up that's it it's you fam
Rihanna,There's A Thug In My Life,Gotta keep it on the down low I'll never let my mama know Only call him on my cell phone Only see him after dark I met him on the six train Just the way he said my name The brother had a lot of game Had me open from the start He scoops me up in his ride Friday about a quarter to nine So fly and so fine and I'm so glad that he's all mine.
Rihanna,Diamonds,Shine bright like a diamond Shine bright like a diamond  Find light in the beautiful sea I choose to be happy You and I you and I We're like diamonds in the sky  You're a shooting star I see A vision of ecstasy When you hold me I'm alive We're like diamonds in the sky  I knew that we'd become one right away Oh right away At first sight I felt the energy of sun rays I saw the life inside your eyes  So shine bright tonight you and I We're beautiful like diamonds in the sky Eye to eye so alive We're beautiful like diamonds in the sky  Shine bright like a diamond Shine bright like a diamond Shine bright like a diamond We're beautiful like diamonds in the sky  Shine bright like a diamond Shine bright like a diamond Shine bright like a diamond We're beautiful like diamonds in the sky  Palms rise to the universe As we moonshine and molly Feel the warmth we'll never die We're like diamonds in the sky  You're a shooting star I see A vision of ecstasy When you hold me I'm alive We're like diamonds in the sky  At first sight I felt the energy of sun rays I saw the life inside your eyes  So shine bright tonight you and I We're beautiful like diamonds in the sky Eye to eye so alive We're beautiful like diamonds in the sky  Shine bright like a diamond Shine bright like a diamond Shine bright like a diamond We're beautiful like diamonds in the sky  Shine bright like a diamond Shine bright like a diamond Shine bright like a diamond We're beautiful like diamonds in the sky  Shine bright like a diamond Shine bright like a diamond Shine bright like a diamond  So shine bright tonight you and I We're beautiful like diamonds in the sky Eye to eye so alive We're beautiful like diamonds in the sky  Shine bright like a diamond Shine bright like a diamond Shine bright like a diamond Oh yeah Shine bright like a diamond Shine bright like a diamond Shine bright like a diamond Shine bright like a diamond
Ariana Grande,Lovin' It,It's The Rascals! Baby don't you know you've got all my love all myLove?  See what you don't understand Is fallin' in love wasn't part of my plan Started with a crush now I call you my man. Doubt that I'll ever fall in love ever fall In love again 'Cause you give me chills every time we chill
Coldplay,Easy To Please,Love I hope we get old I hope we can find a way of seeing it all Love I hope we can be I hope I can find a way of letting you see That I'm so easy to please so easy  Love I hope we grow old I hope we can find a way of seeing it all Love I hope we can be I hope I can find a way of letting you see That I'm so easy to please so easy
Coldplay,Don't Panic,Bones sinking like stones All that we fought for Homes places we've grown All of us are done for  And we live in a beautiful world Yeah we do yeah we do We live in a beautiful world  Bones sinking like stones All that we fought for And homes places we've grown All of us are done for  And we live in a beautiful world Yeah we do yeah we do We live in a beautiful world  And we live in a beautiful world Yeah we do yeah we do We live in a beautiful world  Oh all that I know There's nothing here to run from 'Cause yeah everybody here's got somebody to lean on
Coldplay,Strawberry Swing,They were sitting They were sitting on the strawberry swing Every moment was so precious  They were sitting They were talking under strawberry swing Everybody was for fighting Wouldn't wanna waste a thing  Cold cold water bring me round Now my feet won't touch the ground Cold cold water what you say? When it's such… It's such a perfect day It's such a perfect day  I remember We were walking up to strawberry swing I can't wait until the morning Wouldn't wanna change a thing  People moving all the time Inside a perfectly straight line Don't you wanna just curve away? When it's such… It's such a perfect day It's such a perfect day  Ah-ah-ah-ah-iiiiii  Now the sky could be blue I don't mind Without you it's a waste of time  Could be blue I don't mind Without you it's a waste of time  Now the sky could be blue Could be grey Without you I'm just miles away  Oh the sky could be blue I don't mind Without you it's a waste of time
Lana Del Rey,Cruel World,Shared my body and my mind with you That's all over now Did what I had to do 'Cause you're so far past me now Shared my body and my life with you That's way over now There's not more a mind can do You're so famous now  Got your Bible got your gun And you like to party and have fun And I like my candy and your women I'm finally happy now that you're gone  Put my little red party dress on Everybody knows that I'm the best I'm crazy yeah yeah Get a little bit of bourbon in ya Get a little bit suburban and go Crazy yeah yeah Because you're young you're wild you're free You're dancing circles around me You're fucking crazy Oh oh Oh oh You're crazy for me  I shared my body and my mind with you That's all over now I did what I had to do I found another anyhow Shared my body and my mind with you That's all over now I did what I had to do I could see you leaving now  I got your Bible and your gun And you love to party and have fun And I love your women and all of your heroin And I'm so happy now that you're gone  Put my little red party dress on Everybody knows that I'm a mess I'm crazy yeah yeah Get a little bit of bourbon in ya Go a little bit suburban and go Crazy yeah yeah Because you're young you're wild you're free You're dancing circles around me You're fucking crazy Oh oh oh oh Oh oh oh oh You're crazy for me  Got your Bible and your gun You like your women and you like fun I like my candy and your heroin And I'm so happy so happy now you're gone  Put my little red party dress on Everybody knows that I'm a mess I'm crazy yeah yeah Get a little bit of bourbon in ya Get a little bit suburban and go Crazy yeah yeah 'Cause you're young you're wild you're free You're dancing circles around me You're fucking crazy Oh oh oh Oh oh oh You're crazy for me  Oh oh Oh You're crazy for me
Lana Del Rey,Music To Watch Boys To,(I like you a lot) Putting on my music while I'm watching the boys (So I do what you want) Singing soft grunge just to soak up the noise (With ribbons in knots) Play 'em like guitars only one of my toys ('Cause I like you a lot) No holds barred I was sent to destroy yeah  Pink flamingos Always fascinated me I know what only the girls know Hoes with lies akin to me  I I see you're going So I play my music watch you leave  (I like you a lot) Putting on my music while I'm watching the boys (So I do what you want) Singing soft grunge just to soak up the noise (With ribbons in knots) Play 'em like guitars only one of my toys ('Cause I like you a lot) No holds barred I was sent to destroy yeah  Velveteen and living single It never felt that right to me I know what only the girls know Lies can buy eternity  I I see you leaving So I push record and watch you leave  (I like you a lot) Putting on my music while I'm watching the boys (So I do what you want) Singing soft grunge just to soak up the noise (With ribbons in knots) Play 'em like guitars only one of my toys ('Cause I like you a lot) No holds barred I was sent to destroy yeah  I live to love you And I love to love you And I live to love you boy I live to love you And I love to love you And I live to love you boy Nothing gold can stay Like love or lemonade Or sun or summer days It's all a game to me anyway  (I like you a lot) Putting on my music while I'm watching the boys (So I do what you want) Singing soft grunge just to soak up the noise (With ribbons in knots) Play 'em like guitars only one of my toys ('Cause I like you a lot) No holds barred I was sent to destroy yeah  Putting on my music while I'm watching the boys Putting on my music while I'm watching the boys
Lana Del Rey,Body Electric,Elvis is my daddy Marilyn's my mother Jesus is my bestest friend We don't need nobody 'Cause we got each other Or at least I pretend  We get down every Friday night Dancing and grinding in the pale moonlight Grand Ole Opry We're feeling alright Mary prays the rosary for my broken mind (I said Don't worry 'bout it)  I sing the body electric I sing the body electric baby I sing the body electric I sing the body electric Sing that body electric Sing that body electric I'm on fire Sing that body electric  Whitman is my daddy Monaco's my mother Diamonds are my bestest friend Heaven is my baby Suicide's her father Opulence is the end  We get down every Friday night Dancing and grinding in the pale moonlight Grand Ole Opry We're feeling alright Mary prays the rosary for my broken mind (I said Don't worry 'bout it)  I sing the body electric I sing the body electric baby I sing the body electric I sing the body electric Sing that body electric Sing that body electric I'm on fire Sing that body electric  My clothes still smell like you And all the photographs say you're still young I pretend I'm not hurt And go about the world like I'm having fun  We get crazy every Friday night Drop it like it's hot in the pale moonlight Grand Ole Opry Feeling alright Mary swaying softly to her heart's delight  I sing the body electric I sing the body electric baby I sing the body electric I sing the body electric Sing that body electric Sing that body electric I'm on fire Sing that body electric  I sing the body electric baby I sing the body electric baby I sing the body electric baby
Lana Del Rey,Salvatore,All the lights in Miami begin to gleam Ruby blue and green neon too Everything looks better from above my king Like aquamarine ocean's blue  Ah-ah-ah-ah ah-ah-ah-ah-ah Cacciatore La-da-da-da-da la-da-da-da-da Limousines Ah-ah-ah-ah ah-ah-ah-ah-ah Ciao amore La-da-da-da-da la-da-da-da-da Soft ice cream  All the lights are sparkling for you it seems On the downtown scenes shady blue Beatboxing and rapping in the summer rain Like a boss you sang jazz and blues  Ah-ah-ah-ah ah-ah-ah-ah-ah Cacciatore La-da-da-da-da la-da-da-da-da Limousines Ah-ah-ah-ah ah-ah-ah-ah-ah Ciao amore La-da-da-da-da la-da-da-da-da Soft ice creams  The summer's wild and I've been waiting for you all this time I adore you can't you see you're meant for me? The summer's hot but I've been cold without you I was so wrong not to doubt your Medellín tangerine dreams  Catch me if you can working on my tan Salvatore Dying by the hand of a foreign man happily Calling out my name in the summer rain Ciao amore Salvatore can wait Now it's time to eat soft ice cream  Ah-ah-ah-ah ah-ah-ah-ah-ah Cacciatore Ah-ah-ah-ah ah-ah-ah-ah-ah Limousines Ah-ah-ah-ah ah-ah-ah-ah Ciao amore Ah-ah-ah-ah ah-ah-ah-ah-ah Soft ice cream
Michael Jackson,Just A Little Bit Of You,Just a little bit of you every day Will surely keep the doctor away Just a little bit of you every day Will surely keep the doctor away  I told my mama how I feel about your power Your love can heal can't no doctor's remedy Ever do what you do for me  Just a little bit of you every day Will surely keep the doctor away Eeny weeny teeny bit of your love Baby it's all I need it's all I need  Since the day I've been loving you I can't catch a cold I can't catch the flu The sweet loving you've been giving me Has become my daily need  Just a little o' your love every day It's all I need that's all I need Just a little bit baby That's all I need that's all I need  So don't send no doctor to my door 'Cause Doctor John has been here before Don't you send him just come yourself Bring your loving and nothing else  Ooh just a just a  Just a little bit of you every day Will surely keep the doctor away Just a little bit of you every day Will surely keep the doctor away
Michael Jackson,My Girl,I've got sunshine on a cloudy day When it's cold outside I've got the month of May I guess you'd say What can make me feel this way? My girl (my girl my girl) Talkin' 'bout my girl (my girl)  I've got so much honey the bees envy me I've got a sweeter song than the birds in the trees I guess you'd say What can make me feel this way? My girl (my girl my girl) Talkin' 'bout my girl (my girl)  Hey hey hey Hey hey hey Ooh  I love my baby She makes me feel proud I'll climb the highest mountain And say it aloud  I don't need no money fortune or fame I've got all the riches baby one man can claim Well I guess you'd say What can make me feel this way? My girl (my girl my girl) Talkin' 'bout my girl (talking my girl)  I've got sunshine on a cloudy day With my girl I've even got the month of May With my girl Talkin' 'bout my girl (my girl) Oh yeah my girl (my girl) Ooh my girl (my girl) That'a all that I can talk about It's my girl Yeah yeah my girl
Michael Jackson,You Are There,You are there like the laughter of a child When I need just a smile Suddenly the sun shines for a while  Everywhere sounds of love are everywhere And my heart sings along Thanks to you I finally got a song  'Cause you are there You are there You are there somewhere Each time my world seems like it's falling down Things look up just having you around So every night I say a prayer Just because you're there  Like a rainbow after rain Like the night follows day You're the answer to the prayers I say  And you are there You are there You are there somewhere No matter where I go or what I do You are there to help me see it through So every night I say a prayer Just because you're there  Ooh you are there Ooh you are there somewhere And as the years go by we'll stay as true What you are for me I'll be for you And every night I'll say a prayer Just because you're there  Ooh you are there Ooh you are there Everywhere you are there
Michael Jackson,With A Child's Heart,With a child's heart Go face the worries of the day With a child's heart Turn each problem into play  No need to worry no need to fear Just being alive makes it all so very clear  With a child's heart Nothing can ever get you down With a child's heart You've got no reason to frown  Love is as welcome As a sunny sunny day No grown-up thoughts To lead our hearts astray Take life easy so easy nice and easy Like a child so gay and so carefree Yeah The whole world smiles with you As you go your merry way  Oh with a child's heart Nothing's gonna get me nothing's gonna get Nothing's gonna get me down Oh with a child's heart Nothing's gonna get me nothing's gonna get Nothing's gonna get me down Oh with a child's heart Sing nothing's gonna get me nothing's gonna get Nothing's gonna get me down
Michael Jackson,Beautiful Girl,I'm in love with a beautiful girl I'm in love with a beautiful girl  It's almost like dancing and romancing In her arms It's just a part of it Can't you see that I'm  In love (Love) I'm in love (Love) I'm in love (Love) Da de de da de da da dum (Love) Da da da da da da da dum (Love) La da da da da da da dum Can't you see that I'm in love (Love)  I'm in love with a beautiful girl I'm in love with a beautiful girl  It's almost like dancing and romancing In her arms It's just a part of it Can't you see that I'm  In love? (Love) I'm in love (Love) I'm in love (Love) Da da da da da da da dum (Love) Da da da da da la da dum (Love) She will never know la da da dum Can't you see that I'm in love? (Love)  It's almost like dancing and romancing In her arms It's just a part of it Can't you see that I'm  In love? (Love) I'm in love (Love) I'm in love (Love) She never thought la da da dum (Love) In all of the time le da da dum (Love) La da da da la da da dum Can't you see that I'm in love? (Love)  I'm in love (Love) I'm in love (Love) Can't you see that I'm in love? (Love) I'm in love (Love) I'm in love (Love) Can't you see that I'm in love? (Love) I'm in love (Love) I'm in love (Love) I'm in (Love)
Michael Jackson,I Just Can't Stop Loving You,I just want to lay next to you for a while You look so beautiful tonight Your eyes are so lovely Your mouth is so sweet A lot of people misunderstand me That's because they don't know me at all I just want  to touch you And hold you I need you God I needYou I love you so much.
Michael Jackson,I Can't Help It,Looking in my mirror Took me by surprise I can't help but see you Running often through my mind Helpless like a baby Sensual disguise I can't help but love you It's getting better all the time  I can't help it if I wanted to I wouldn't help it even if I could I can't help it if I wanted to I wouldn't help it no I can't help it if I wanted to I wouldn't help it even if I could I can't help it if I wanted to I wouldn't help it no  Love to run my fingers Softly while you sigh Love came and possessed you Bringing sparkles to your eyes Like a trip to heaven Heaven is the prize And I'm so glad I found you yeah You're an angel in disguise  I can't help it if I wanted to I wouldn't help it even if I could I can't help it if I wanted to I wouldn't help it no I can't help it if I wanted to I wouldn't help it even if I could I can't help it if I wanted to I wouldn't help it no  And I'm so glad I found you yeah You're an angel in disguise  I can't help it if I wanted to I wouldn't help it even if I could I can't help it if I wanted to I wouldn't help it no I can't help it if I wanted to I wouldn't help it even if I could I can't help it if I wanted to I wouldn't help it no I can't help it if I wanted to I wouldn't help it even if I could I can't help it if I wanted to Wouldn't help it no no I can't help it if I wanted to I wouldn't help it even if I could I can't help it if I wanted to Wouldn't help it no no no
Michael Jackson,Heaven Can Wait,Tell the angels no I don't want nobody else to hold you That's a chance I'll take Baby I'll stay Heaven can wait No if the angels took me from this earth I would tell them bring me back to her It's a Chance I'll Take maybe I'll Stay. You're beautiful you're wonderful Incredible I love you so.
Michael Jackson,Girl You're So Together,Girl you're so together Together we can make it all the way If I had a chance to choose Between a million bucks and you I'd choose you babe yeah  There's no tree That bears fruits as sweet as you no Apples peaches And cherries just won't do ooh baby Even the flowers and lollipops Could never hope to top The sweetness of your kiss Can you dig it?  Girl you're so together And together we can make it all the way yeah yeah If I had a chance to choose Between a million bucks and you I'd choose you babe (Choose you babe)  Girl your smile ooh Is like the month of May yeah When you're near me The storm clouds stay away yeah Even the little honey bees Turn to you when they need more honey Love you so much it's not funny  Girl you're so together And together we can make it all the way yeah  Oh girl you're so together Oh hey girl you're an eye-eye-popper A real life traffic stopper A knockout queen Oh what I mean is  Girl you're so together And together we can make it all the way Oh I love her I love her I love I love you baby (Girl you're so together) Yeah (And together we can make it all the way) Oh girl you're so together (Girl you're so together And together we can make it all the way) Oh girl you're so together (Girl you're so together And together we can make it all the way) Yeah yeah you're so together (Girl you're so together And together we can make it all the way Girl you're so together And together we can make it all the way)
